,id,Materia,Descripcion,Status,Periodo
1171,760c89babdfb4c4bb505b96b44ec40ff,Educación Fisica,Facere iure consequatur architecto.,Inactivo,Periodo 2003-2004
1172,239ca1653c6c49bbbcdd5eeaa9fed0e5,Lenguaje y Comunicación,Cum vel beatae odit.,Inactivo,Periodo 2021-2022
1173,1fc02b2050a8424eb93760231fede52f,Educación SocioEmocional,Non dignissimos eligendi accusamus eos illum debitis.,Inactivo,Periodo 2000-2001
1174,23562900c39648cea152ddd362bef95f,Pensamiento Matemáico,Corrupti corrupti dolores commodi ex ad.,Inactivo,Periodo 2005-2006
1175,001bea2e558b4deb96887e17d1ad2b83,Lenguaje y Comunicación,Perferendis aliquid placeat eligendi culpa.,Inactivo,Periodo 2016-2017
1176,d2289ca514fc4e0d9a40cc2b5124d97e,Lenguaje y Comunicación,Repudiandae expedita impedit fugiat cupiditate in nobis labore.,Inactivo,Periodo 2000-2001
1177,23a46bebb8314e5081306d853f610178,Educación Fisica,Enim quo libero ullam.,Inactivo,Periodo 2017-2018
1178,cd85221a6efe4264a9c4ae668fa9f523,Educación SocioEmocional,Reiciendis provident impedit nostrum at in.,Inactivo,Periodo 2015-2026
1179,03c843b47fb34ff7901ef0e7feb581d0,Educación Fisica,Ullam voluptatem minima repellat delectus.,Inactivo,Periodo 2010-2011
1180,90998289dc8244ae9dddead0f24b9ead,Artes,Laborum quisquam et fuga accusantium.,Inactivo,Periodo 2020-2021
1181,fa85279814cd4e82b6b66f20bdff5b45,Pensamiento Matemáico,Laboriosam nesciunt quam eveniet.,Inactivo,Periodo 2009-2010
1182,31b3de0db0b141ed922919a7096edcd5,Pensamiento Matemáico,Non eos soluta temporibus illo unde.,Inactivo,Periodo 2009-2010
1183,8489356f128848b5bb7fbe13fddad706,Educación Fisica,Autem eos et est accusantium praesentium veritatis.,Inactivo,Periodo 2008-2009
1184,3aee12303b154d7d908b472ea8fc03de,Exploración y Comprensión del mundo natural y social,Alias quaerat illum nam.,Inactivo,Periodo 2020-2021
1185,dbd27800ac1f45edb22c9383ee2b36a6,Exploración y Comprensión del mundo natural y social,Accusantium officia deserunt ipsa.,Inactivo,Periodo 2007-2008
1186,38e47b19391d4dd384823b5a19637b3d,Educación SocioEmocional,Illum suscipit molestiae consequuntur blanditiis expedita cum.,Activo,Periodo 2022-2023
1187,248c526f121943c5af27ed28caae93e5,Lenguaje y Comunicación,Ducimus adipisci molestias.,Inactivo,Periodo 2018-2019
1188,92364d974294424d8f6fb26e2fc820b1,Pensamiento Matemáico,Consequatur voluptas illo explicabo voluptates blanditiis nihil.,Inactivo,Periodo 1999-2000
1189,90b0f9ea85334a938c60814491374bd7,Educación Fisica,Quasi vel eum cumque.,Activo,Periodo 2022-2023
1190,1d01178d3e0d4d61b974d2121149cf61,Exploración y Comprensión del mundo natural y social,Nulla fuga non eius soluta ex dicta.,Inactivo,Periodo 2008-2009
1191,cc02353b6eef4698ac566a9b5cb3b3c2,Lenguaje y Comunicación,Occaecati deserunt magnam molestias nesciunt dolores.,Inactivo,Periodo 2018-2019
1192,df52b48b458d4f35952e38b623bc56f5,Pensamiento Matemáico,Minima voluptatibus laudantium numquam voluptatem.,Inactivo,Periodo 2006-2007
1193,f11507de9bef4be5b7d01c701149dc0d,Educación Fisica,Quos nostrum culpa quaerat itaque.,Inactivo,Periodo 2019-2020
1194,9b87f24eebb8472facee6594a61fecd6,Exploración y Comprensión del mundo natural y social,Vel minima deleniti suscipit a impedit aliquid eveniet.,Inactivo,Periodo 2015-2026
1195,f7b6531082ed41a3b69be0c4ae177166,Pensamiento Matemáico,Cum consectetur natus hic autem amet.,Inactivo,Periodo 2020-2021
1196,c610d16cacb94dc2bb413707f4b835d0,Educación SocioEmocional,Sunt soluta rerum vero possimus.,Inactivo,Periodo 2003-2004
1197,777cb4f4129f4ef286234bd5c0b33138,Pensamiento Matemáico,Error corrupti exercitationem quia voluptatibus.,Inactivo,Periodo 2010-2011
1198,90a24e65929f4fda91fa4b18f81cf634,Educación SocioEmocional,Illum quaerat quam facilis voluptatum a.,Inactivo,Periodo 2004-2005
1199,5e7fb86d03c74edaa2d7fe448fbcad6a,Exploración y Comprensión del mundo natural y social,Soluta molestiae culpa vero assumenda.,Inactivo,Periodo 1999-2000
1200,8ddd7269224b4447a889190df9306bff,Lenguaje y Comunicación,Illo minus officiis earum adipisci laborum expedita.,Inactivo,Periodo 2016-2017
1201,273e3566f3a4414aa3def05997581813,Lenguaje y Comunicación,Quia fugit omnis voluptatem ut sit.,Inactivo,Periodo 2007-2008
1202,ffca27fc09dd4543b33e59dd45293011,Exploración y Comprensión del mundo natural y social,Soluta quod voluptatum hic facere velit accusamus.,Inactivo,Periodo 2013-2014
1203,abac90691b7942a687a0f471e528a9bc,Pensamiento Matemáico,Impedit ea nobis dignissimos corrupti dicta necessitatibus.,Inactivo,Periodo 2019-2020
1204,8ecc16341ecf4cfba5945640a056931d,Exploración y Comprensión del mundo natural y social,Occaecati magnam facilis magni quibusdam accusamus recusandae.,Inactivo,Periodo 2005-2006
1205,f5d731cd6cd845538fcf25c3104f5475,Artes,Molestias exercitationem iste laborum omnis blanditiis.,Inactivo,Periodo 2002-2003
1206,261d9a0572b441be9bf064b3b6f04a92,Educación SocioEmocional,Eius occaecati dicta inventore sint.,Inactivo,Periodo 2021-2022
1207,cddb8b21211f4e73bdd381b6299acfb1,Artes,Dolores ab aperiam reprehenderit ratione occaecati.,Inactivo,Periodo 1999-2000
1208,94e916f62d544f56b4025491d5c959f2,Educación SocioEmocional,Fugiat nisi qui vero.,Inactivo,Periodo 2009-2010
1209,55c8bd78061543aca290a46e81a3edf6,Educación Fisica,Repellat quidem quae hic eos animi.,Inactivo,Periodo 2018-2019
1210,9ac88d2981574d56909dc507a4665c97,Pensamiento Matemáico,Iure laboriosam mollitia excepturi distinctio soluta sunt.,Inactivo,Periodo 1999-2000
1211,3e730d9e1b3c4d6db9b5fd1811ddbd34,Educación SocioEmocional,Vel in consequuntur ea.,Inactivo,Periodo 2008-2009
1212,82e0931a6c6e410fa0a92a827169a072,Educación SocioEmocional,Corporis totam dolor accusantium impedit unde modi.,Inactivo,Periodo 2013-2014
1213,9f6b5adfa3e942ea919639b63c1f7bae,Lenguaje y Comunicación,Voluptas reprehenderit a asperiores doloremque occaecati.,Inactivo,Periodo 2009-2010
1214,0b975a953f8943f6b7285e738b6507dc,Artes,Laudantium quae error dolorem dolore ad doloremque.,Inactivo,Periodo 2015-2026
1215,959846ff65ba4a1886104bcc9fe9c645,Educación SocioEmocional,Aliquam quasi aliquid velit in laboriosam.,Inactivo,Periodo 2003-2004
1216,41439e3a070948969313427cc8fd19ea,Exploración y Comprensión del mundo natural y social,Unde voluptatibus id officia.,Inactivo,Periodo 2017-2018
1217,fd627eca10c443d480a0a3d8bca55ea9,Artes,In dicta modi deserunt alias iure dolorum omnis.,Inactivo,Periodo 2002-2003
1218,8fe912c481634db5aee3666fb033c0a9,Pensamiento Matemáico,Eos exercitationem ut labore.,Inactivo,Periodo 2004-2005
1219,39ae839fb9e14eadbe8c26df391ca9a0,Lenguaje y Comunicación,Optio praesentium deleniti sapiente.,Inactivo,Periodo 2015-2026
1220,19b372f152c744c88807339a4c3361b5,Educación SocioEmocional,Tenetur beatae fugit eveniet dolor.,Inactivo,Periodo 2019-2020
1221,213d0b3f14644ec7979f0f5acdb9104c,Educación SocioEmocional,Modi doloribus quo omnis in optio.,Inactivo,Periodo 2015-2026
1222,bebcaf34458b47cb8147e104ae43f0d3,Artes,Modi eum nostrum ratione distinctio cupiditate nesciunt.,Inactivo,Periodo 2004-2005
1223,38fa1190baa64f72b8bd7f092d7d1385,Educación Fisica,Exercitationem alias enim hic sed ratione fugiat.,Inactivo,Periodo 2009-2010
1224,6a7e511d758b4a13a932d07eb816f6fe,Pensamiento Matemáico,Incidunt molestias sint maiores fugit eligendi.,Inactivo,Periodo 2003-2004
1225,fe528ebdc0e94f27b6b076fac826d1db,Exploración y Comprensión del mundo natural y social,Aspernatur alias doloremque nisi facere.,Inactivo,Periodo 2019-2020
1226,57e631a4070747f09465235ff6d3212b,Pensamiento Matemáico,Nesciunt doloribus officia autem.,Inactivo,Periodo 2003-2004
1227,8a2f0d2b669e43cabd91177174615cd2,Pensamiento Matemáico,Aspernatur labore porro magni asperiores deleniti ullam.,Inactivo,Periodo 2004-2005
1228,92f7122a47604452ba2c172f18348df2,Artes,Aperiam dolorem voluptas.,Inactivo,Periodo 2021-2022
1229,e875f6317149489796684c02d9751c31,Pensamiento Matemáico,Maxime iste accusamus ad illum vero rerum.,Inactivo,Periodo 2020-2021
1230,079ff14eea7b4d3f9892e7b6dfb790da,Pensamiento Matemáico,Sapiente reprehenderit quo odio neque mollitia tempore.,Inactivo,Periodo 2004-2005
1231,9103ec3370a743cbbdd6cc5cd3f2786c,Educación Fisica,Quia quas harum minima eum sapiente reiciendis.,Inactivo,Periodo 2021-2022
1232,399ce53385f2468989f998eb30994ff7,Artes,Similique unde necessitatibus maxime quisquam vel.,Inactivo,Periodo 2001-2002
1233,7dd63613c6d843a59a238ff9272bda73,Educación Fisica,Quam debitis voluptatem quasi expedita laboriosam.,Inactivo,Periodo 2008-2009
1234,4db3cca8219c4a8eab4e1beb6ae51520,Educación SocioEmocional,Praesentium temporibus assumenda molestiae voluptas.,Inactivo,Periodo 2018-2019
1235,f625dd494dde47cb9590c69eec1a23ef,Exploración y Comprensión del mundo natural y social,Amet possimus nulla error dolorem odio.,Inactivo,Periodo 2004-2005
1236,d52d8fdcf1ba4a2ca06b25351b35e1b0,Pensamiento Matemáico,Modi inventore fugit ducimus.,Inactivo,Periodo 2004-2005
1237,5b9f1ed089c949af9e3339a50aba6273,Educación Fisica,Sed cumque earum eveniet quae quibusdam repudiandae fugiat.,Inactivo,Periodo 2020-2021
1238,3f598da77d214fa994fd14bb202870fc,Exploración y Comprensión del mundo natural y social,Perspiciatis fugiat molestiae explicabo sit architecto saepe consequatur.,Inactivo,Periodo 2010-2011
1239,6adabe531ca94b418199d0e714a79f63,Educación SocioEmocional,Ducimus omnis ad illum atque rem recusandae.,Inactivo,Periodo 2006-2007
1240,edfb7f54e5134dacbc38b23533e77699,Artes,Exercitationem pariatur labore occaecati.,Inactivo,Periodo 2007-2008
1241,792decd3191c4d92929187e7c5ac892e,Artes,Reiciendis quibusdam voluptate repellat vel soluta provident quam.,Inactivo,Periodo 1999-2000
1242,14386a05350341a6a7b76e72d5b109c2,Artes,Magnam corporis adipisci repellendus est magnam.,Inactivo,Periodo 2001-2002
1243,8e30c08c92e44c72994dbe09e82ef1f7,Educación SocioEmocional,Cumque ipsum non facilis repudiandae.,Inactivo,Periodo 2013-2014
1244,b5340862ffd540359398d465bd6d6e3e,Pensamiento Matemáico,Neque quaerat porro eaque libero esse quasi.,Inactivo,Periodo 2003-2004
1245,a208c99687484277b86bae98d1b4e6de,Educación SocioEmocional,Ratione accusantium perferendis qui.,Inactivo,Periodo 2014-2015
1246,d75d152141e04f94af488daee2a67a97,Educación Fisica,Expedita delectus dolorem eum consectetur occaecati magnam minus.,Activo,Periodo 2022-2023
1247,f2274478b84d4e229927cc213c48a968,Exploración y Comprensión del mundo natural y social,Pariatur iure quibusdam quaerat at.,Inactivo,Periodo 2019-2020
1248,675e04a889264f82817744ef02163d35,Educación SocioEmocional,Magni quisquam impedit a.,Activo,Periodo 2022-2023
1249,d03c7821e16341029fde0afde2c31d38,Artes,Dicta pariatur dolores ea.,Inactivo,Periodo 2005-2006
1250,9f2df373443c4a8f861af475704f6489,Lenguaje y Comunicación,Error asperiores qui esse deleniti eum.,Inactivo,Periodo 2017-2018
1251,62cfccd76d1e4765b68bc6716ee2745d,Educación SocioEmocional,Provident atque suscipit mollitia molestias.,Inactivo,Periodo 2006-2007
1252,74e2b887bfa846a389144f7d490ae1f3,Educación SocioEmocional,Eos repellendus odio rerum odit.,Inactivo,Periodo 2004-2005
1253,a9bafea8e575453aaef579363b755527,Lenguaje y Comunicación,Velit consectetur neque distinctio.,Inactivo,Periodo 2000-2001
1254,c63e52e4116c492493ee1a1e46951290,Educación SocioEmocional,Inventore tempore fugiat architecto voluptatem ab.,Inactivo,Periodo 2002-2003
1255,f193adc669d04fc4a39f0c52a6cb34ce,Pensamiento Matemáico,At facere quod eos.,Inactivo,Periodo 2017-2018
1256,f08b44ecc4eb4f968f573edf93c18ef3,Educación SocioEmocional,Provident ullam quidem.,Inactivo,Periodo 2005-2006
1257,cc7aeffac2a148fda0f5e90fa1aa0659,Lenguaje y Comunicación,Placeat nam tenetur quae illo.,Inactivo,Periodo 2005-2006
1258,3e5ca38390e04f74b8f54a4b97754e2b,Exploración y Comprensión del mundo natural y social,Sint exercitationem beatae et eos soluta.,Inactivo,Periodo 2001-2002
1259,8af41501528c4d7b99511d1c330cb2a8,Lenguaje y Comunicación,Accusamus voluptatum repellat tempora eaque aliquid.,Inactivo,Periodo 2006-2007
1260,bb70212921b1466da0d9a62256547372,Artes,Fuga occaecati reprehenderit facilis reprehenderit neque fugit.,Inactivo,Periodo 2020-2021
1261,cbe3e14e3af949b380bd5dd3df44e544,Pensamiento Matemáico,Libero veritatis magni minus consequatur.,Inactivo,Periodo 2014-2015
1262,d3fb7b845c084a0eae37ddc8524d7529,Educación Fisica,Ut magni corrupti optio eius totam.,Inactivo,Periodo 2021-2022
1263,95cbb55ebc2643488d4f7e4bc363ab58,Pensamiento Matemáico,Qui perferendis fugit asperiores itaque explicabo.,Inactivo,Periodo 2008-2009
1264,280854b3103d49c09cb4186b8f2b7070,Artes,Qui magni velit id.,Inactivo,Periodo 2009-2010
1265,3aaf2f772c164d898c73b33e9c2afaf4,Lenguaje y Comunicación,Ipsa vel et tempore.,Inactivo,Periodo 2011-2012
1266,8003ff7622a849aeac8214d36fb0e153,Educación SocioEmocional,Et repellat adipisci earum ex sequi.,Inactivo,Periodo 2009-2010
1267,4a27fda0b7b14aa3b3841b6e74ebb64f,Artes,Ullam nesciunt odit magnam rerum accusamus.,Inactivo,Periodo 2002-2003
1268,75cd4d7f65ac457f8f444cd98d2a57d6,Exploración y Comprensión del mundo natural y social,Aperiam harum quidem.,Inactivo,Periodo 2011-2012
1269,02ee432d288645ac977b3b4736dc0c73,Educación Fisica,Nulla quod accusantium suscipit beatae reiciendis similique.,Inactivo,Periodo 2017-2018
1270,bde1545ea1324b03ba48aae60350b15d,Exploración y Comprensión del mundo natural y social,Distinctio voluptatum eaque atque.,Inactivo,Periodo 2013-2014
1271,fe9395c2668549e19cab20db5ce553a0,Exploración y Comprensión del mundo natural y social,Dicta exercitationem voluptas laboriosam cum suscipit inventore.,Activo,Periodo 2022-2023
1272,c66f68e6e148460282be7b22db8e19a0,Pensamiento Matemáico,Voluptates labore corporis distinctio a.,Inactivo,Periodo 2003-2004
1273,b8deba5ed1274398b33b3946f69b5e46,Artes,Aperiam animi quo alias.,Inactivo,Periodo 2000-2001
1274,dc31ebd8d6e64d07b31564d8c82f8dd0,Exploración y Comprensión del mundo natural y social,Voluptatum voluptate voluptates dicta corrupti voluptas.,Inactivo,Periodo 2013-2014
1275,6411df926723477a98a0da962e73020e,Lenguaje y Comunicación,Deserunt dolorum ex nostrum.,Inactivo,Periodo 2007-2008
1276,d85a71ca510a403ab67d6f125700fb9b,Artes,Vero corporis dolores accusantium harum.,Inactivo,Periodo 2001-2002
1277,353e0390ad5e4bc1b407b9291edb4526,Educación Fisica,Iusto excepturi repellendus illo iure.,Inactivo,Periodo 2015-2026
1278,951f829902234a0a8783487a4f32fa5e,Educación SocioEmocional,Beatae eos aut nemo.,Inactivo,Periodo 2020-2021
1279,66620084f4fc4b2d96f2936317e97815,Educación SocioEmocional,Adipisci voluptas itaque beatae soluta quam libero laborum.,Inactivo,Periodo 2014-2015
1280,24e8a37a10e64d458f4a37bf9d8cc9b0,Exploración y Comprensión del mundo natural y social,Animi animi quia ex harum aperiam veritatis.,Inactivo,Periodo 2017-2018
1281,4c779781aa154cf1ad3be61ed761cd84,Lenguaje y Comunicación,Enim vitae dignissimos aspernatur eligendi.,Inactivo,Periodo 2002-2003
1282,d86ce7c5e6214cd2ba4ac666fdf13a6c,Lenguaje y Comunicación,Totam fuga corrupti soluta.,Inactivo,Periodo 2019-2020
1283,4798c2bbae904a12b3772aa25547ab44,Lenguaje y Comunicación,Hic blanditiis error ab asperiores non.,Inactivo,Periodo 2000-2001
1284,44a6f7d8f567499ea137b72c95f5be9a,Exploración y Comprensión del mundo natural y social,Nemo nihil saepe.,Inactivo,Periodo 2009-2010
1285,60b745e714224247b0b10a61c6b5b91c,Lenguaje y Comunicación,Ratione dignissimos soluta rerum sequi suscipit.,Inactivo,Periodo 2021-2022
1286,89dff51edf1c4f1d9d6e9782e6df92d2,Educación Fisica,Provident reiciendis ipsa veniam recusandae cumque maiores.,Inactivo,Periodo 2006-2007
1287,55dc29319e424589b20a44ccf280ba55,Lenguaje y Comunicación,Atque quis quisquam quam amet nesciunt.,Inactivo,Periodo 2004-2005
1288,7eec9cd459d74edcbcad5e368cbc0f68,Educación SocioEmocional,Deleniti harum commodi sed alias accusantium.,Inactivo,Periodo 2006-2007
1289,ed5f1c7fad28493981fc418f6d454a98,Educación Fisica,Consequatur sit accusamus voluptas.,Inactivo,Periodo 2009-2010
1290,7920e9f889e14990800e0f3674ee4d75,Educación Fisica,Modi aspernatur cupiditate commodi explicabo.,Inactivo,Periodo 2009-2010
1291,fdf43ac426174d2dbad8daeb3996a728,Educación Fisica,Non vel molestiae blanditiis ipsam.,Inactivo,Periodo 2010-2011
1292,ac37d979208d4dccad305424729de6cb,Educación SocioEmocional,Ex consequuntur provident eveniet cum numquam.,Inactivo,Periodo 2021-2022
1293,32e3f3c2f7d94905bbfdee7fab7d7895,Educación Fisica,Provident pariatur dolorum.,Inactivo,Periodo 2019-2020
1294,e12ec0387c9b4fa1abd9a7b1fd26e2e0,Pensamiento Matemáico,Vero consectetur repellendus doloremque ipsam eligendi.,Inactivo,Periodo 2010-2011
1295,7d0833ea06ba4d6d810df9f47e9f2f88,Educación Fisica,Fugiat assumenda sunt.,Inactivo,Periodo 2003-2004
1296,ba882ceb96464f0a9676a7e5df792f2c,Educación SocioEmocional,Ducimus accusamus consequatur ad quam.,Inactivo,Periodo 2018-2019
1297,646c49fd1a1e4714961592d4db13d8d3,Educación SocioEmocional,Quod porro voluptate ex illum similique ipsum.,Activo,Periodo 2022-2023
1298,2026989254f0499c875c48b0dc38103b,Pensamiento Matemáico,Rerum ab aperiam atque iusto.,Inactivo,Periodo 2010-2011
1299,b80fe96ebfb74062aba3cef7398ff70b,Educación Fisica,Exercitationem aliquam ab expedita labore quam mollitia.,Inactivo,Periodo 1999-2000
1300,ef3f4b91740448d2b89b096b100f0af8,Exploración y Comprensión del mundo natural y social,Nobis hic dolorem dolore alias quae.,Inactivo,Periodo 1999-2000
1301,47b92dfaa17947f6818a1dcbea4147ab,Lenguaje y Comunicación,Vitae perferendis quisquam recusandae tempore cum maiores.,Inactivo,Periodo 2018-2019
1302,60ccd32b45a9433991bdb9aabe1c9477,Educación Fisica,Laudantium dolorem delectus facilis doloribus harum soluta.,Inactivo,Periodo 2020-2021
1303,af590c4044a14831af5c6b9133e3765a,Educación Fisica,Earum magni vel ipsam incidunt debitis.,Inactivo,Periodo 2005-2006
1304,0c99a2466d254a5cafc6c60c63ff61e9,Educación Fisica,Ab sed beatae culpa.,Inactivo,Periodo 2009-2010
1305,f269fa586a8f492396142eb5367082a3,Educación Fisica,Voluptatum consectetur corporis nesciunt.,Inactivo,Periodo 2008-2009
1306,2fb25607a1e94b27a6e70625d63bba70,Exploración y Comprensión del mundo natural y social,Perspiciatis cumque fuga laboriosam dicta eligendi inventore.,Inactivo,Periodo 2018-2019
1307,0b575ad1667f43fcb32872915fcffca0,Educación Fisica,Unde magnam quibusdam iure ab quibusdam.,Inactivo,Periodo 2017-2018
1308,e312f39a2df94942a26c4b0aadd4c07e,Exploración y Comprensión del mundo natural y social,Quidem molestiae quod neque possimus corporis soluta.,Inactivo,Periodo 2006-2007
1309,079a89fedece4354a23b29d16866f33d,Educación SocioEmocional,Sint culpa aliquam iusto consectetur.,Activo,Periodo 2022-2023
1310,3d12cf6079d54638b80378f026b701e4,Educación SocioEmocional,Nesciunt velit expedita libero.,Inactivo,Periodo 2019-2020
1311,1171dafc720f4cc4a61754dfccc3eb5f,Artes,Veritatis commodi natus cum architecto.,Inactivo,Periodo 2000-2001
1312,40b137b481364203b8676e8ed1a34138,Artes,Quod magni vitae vitae modi occaecati veritatis.,Inactivo,Periodo 2011-2012
1313,728e548de8074f529b230af401e51381,Educación Fisica,Unde ex expedita.,Inactivo,Periodo 2017-2018
1314,efe3977f46044be1b740fda3b7e44760,Artes,Eos quaerat repellat vel porro nisi.,Inactivo,Periodo 2003-2004
1315,6077e7f1da854350943b7ef27c89124f,Pensamiento Matemáico,Optio nam error laborum veritatis ad facere.,Inactivo,Periodo 2021-2022
1316,0a7713837ac549588b3be3c3e758be44,Artes,Neque quis voluptatum nulla soluta ratione.,Inactivo,Periodo 2007-2008
1317,106bb4995c334ae99719a9836ba7826c,Educación SocioEmocional,Alias accusantium nesciunt debitis porro.,Activo,Periodo 2022-2023
1318,432dc07dc9f144e3afe4a26d3c997137,Educación SocioEmocional,Et quo eaque rem error fugiat.,Inactivo,Periodo 2004-2005
1319,ec3c5f04b8e34bbbbf33935b23bd9e33,Pensamiento Matemáico,Voluptate ex at fugiat laudantium expedita ea.,Inactivo,Periodo 2005-2006
1320,7a8df7e39099425282feac82f681c9c8,Pensamiento Matemáico,Eum optio dolorem sequi et in.,Inactivo,Periodo 2009-2010
1321,42b8d15697fa416ea66fc44ac59a73cd,Lenguaje y Comunicación,Modi libero amet fugit eum exercitationem vero.,Activo,Periodo 2022-2023
1322,cd17c75e605141bdafdd55af06d8de36,Artes,Incidunt omnis temporibus nobis odio deleniti corrupti.,Inactivo,Periodo 2016-2017
1323,234f99a71f614d90bf68e27cd55ab88f,Educación Fisica,Magnam fuga voluptatem quibusdam illum unde soluta.,Inactivo,Periodo 2002-2003
1324,f5eb2b30b3154ff9b6f4a744c4eb5c58,Artes,Dolore officiis enim ipsum laudantium.,Inactivo,Periodo 2008-2009
1325,795fd6e6adbd4a919a36faa92e00659b,Artes,Necessitatibus dolorum saepe quam reiciendis harum.,Inactivo,Periodo 2014-2015
1326,4dbbb620154d4a22a30c6d09ebc93200,Educación SocioEmocional,Laboriosam perspiciatis sed accusantium est pariatur.,Inactivo,Periodo 2011-2012
1327,001d8981a43343be9c871b7c68853ab5,Pensamiento Matemáico,Maxime minus mollitia qui.,Inactivo,Periodo 2016-2017
1328,d6aabad756c145d6a0593aae051af13e,Artes,Nobis pariatur veniam officia cumque ea doloribus.,Inactivo,Periodo 2012-2013
1329,9b0ee0b8b0394e32a1d38375a4a2d08d,Educación SocioEmocional,Quae ea assumenda doloremque repudiandae aspernatur esse.,Inactivo,Periodo 2007-2008
1330,7be5787ec3324b55b7b7fe630d510c0d,Artes,Cupiditate tempore in.,Inactivo,Periodo 2017-2018
1331,e4ab5ec377254c458206064456ac872c,Pensamiento Matemáico,Aut quisquam eius eius incidunt distinctio.,Inactivo,Periodo 2004-2005
1332,5b3da1db162644238f35895ece28b1fc,Pensamiento Matemáico,Velit blanditiis nisi aut error aut ad optio.,Inactivo,Periodo 2012-2013
1333,3e61b24c820640f48d187ba6a945da77,Educación SocioEmocional,Recusandae laudantium praesentium at dignissimos.,Inactivo,Periodo 2020-2021
1334,a139b8fba68f492fafe21b4a28d0294c,Educación Fisica,Atque temporibus ullam repudiandae laborum.,Inactivo,Periodo 2012-2013
1335,933ff65c65d944fd8ce0f1373a72fb54,Pensamiento Matemáico,Consequuntur perspiciatis non iure quos est numquam.,Inactivo,Periodo 2000-2001
1336,fe25b351bdc44248bee36aaa7557ea5e,Educación SocioEmocional,Voluptatum ut in delectus praesentium.,Inactivo,Periodo 2000-2001
1337,7c8fc5ff1a914c7eaa57d2b871a5cbbf,Artes,Possimus a debitis voluptas ipsam.,Inactivo,Periodo 2020-2021
1338,5cf12c581df444faaee93fef6d2e1dbc,Lenguaje y Comunicación,Aperiam error repudiandae harum.,Inactivo,Periodo 2011-2012
1339,4c191537326747e193cb7b21038f437b,Artes,Voluptates voluptate ut.,Inactivo,Periodo 2018-2019
1340,addfd007ecb64d538dbbb8ea9c9fb2a1,Educación Fisica,Repellat dicta enim natus sit.,Activo,Periodo 2022-2023
1341,b7c077371bd24743a5a3242aace88b83,Pensamiento Matemáico,Error assumenda unde.,Inactivo,Periodo 2019-2020
1342,a8ac8cb465794e849c6b8f23e03e0d73,Educación Fisica,Dolorum eos pariatur autem.,Inactivo,Periodo 2016-2017
1343,b3a99db7290045bfbff040626cffdc28,Exploración y Comprensión del mundo natural y social,Id accusamus nihil labore quasi eligendi eum.,Activo,Periodo 2022-2023
1344,b99a41dde038415d8eb4d5e84a0d6cf1,Educación Fisica,Adipisci quasi eligendi eveniet nihil esse blanditiis.,Inactivo,Periodo 2001-2002
1345,acd07a80fbd349a3aec11c2ae01c037f,Exploración y Comprensión del mundo natural y social,Officia atque fugiat voluptates sunt ea repudiandae.,Inactivo,Periodo 2011-2012
1346,dcb676ac53334da9a054145838e5ccf0,Exploración y Comprensión del mundo natural y social,Optio voluptas adipisci quaerat asperiores.,Inactivo,Periodo 2021-2022
1347,9777a807d64148f79e8609975f8c1963,Exploración y Comprensión del mundo natural y social,Provident magnam in voluptatem porro.,Inactivo,Periodo 2020-2021
1348,b83a83f3e72846b09c1efd06f2a9a9d0,Exploración y Comprensión del mundo natural y social,Officia provident recusandae est facere.,Inactivo,Periodo 2012-2013
1349,60ebb9c08e394dd0ba1b7633db7c436e,Exploración y Comprensión del mundo natural y social,Dolorem cum ab aut.,Inactivo,Periodo 2011-2012
1350,2255348e736a4f55a52eeb4f3d3a3746,Lenguaje y Comunicación,Soluta quisquam illum.,Inactivo,Periodo 2006-2007
1351,0d103dd7bbd843ab8c87056a501aeb97,Lenguaje y Comunicación,Vel atque iusto neque labore rem.,Inactivo,Periodo 2001-2002
1352,bb04eee894074e629bfdfe9e4a3afcf2,Pensamiento Matemáico,Iure saepe earum quisquam error delectus.,Inactivo,Periodo 2009-2010
1353,f3de989ad7c44dcaba277a7beeb24a84,Pensamiento Matemáico,Vel voluptate aut sunt et reprehenderit.,Inactivo,Periodo 2017-2018
1354,41d8989688a54e8ebe221f9f46608487,Exploración y Comprensión del mundo natural y social,Earum quo fuga esse quae dolorem.,Inactivo,Periodo 2003-2004
1355,b94fe145880a494b88b6558a59d467e1,Lenguaje y Comunicación,Repellendus error rerum fugiat maiores nulla cumque voluptatem.,Inactivo,Periodo 2011-2012
1356,e9f33ba6782d447ab923ce254e7fe07b,Artes,Consectetur nemo ullam facilis iure.,Inactivo,Periodo 2016-2017
1357,6b87a81b52474b5ca3c511a54aa159b0,Pensamiento Matemáico,Sequi voluptas dignissimos ea dolores consequuntur quasi.,Inactivo,Periodo 2013-2014
1358,ccfb5336eb244930b47c675651a33f35,Lenguaje y Comunicación,Porro blanditiis a laborum.,Inactivo,Periodo 2011-2012
1359,62e2139df70248e089c0a40dc78ea1eb,Exploración y Comprensión del mundo natural y social,Veniam placeat perferendis.,Inactivo,Periodo 2019-2020
1360,97bbbc403c394de0a4e01f732bfc2bea,Exploración y Comprensión del mundo natural y social,Odit amet adipisci natus vitae.,Inactivo,Periodo 2000-2001
1361,ebea4539740d433097276bb42fff6a51,Pensamiento Matemáico,Quae quidem dolorum tempore sint ad quos.,Inactivo,Periodo 1999-2000
1362,8721f8bceddc4f78b34d5d7881ea71af,Lenguaje y Comunicación,Ut recusandae quo dolore minima.,Inactivo,Periodo 2015-2026
1363,f85e7ff1c0fb46b8b8d1e5f835076ed8,Artes,Blanditiis atque occaecati.,Inactivo,Periodo 2000-2001
1364,f0d5dbe469324a4d9c259ebb7e21daa4,Artes,Nam facere accusamus optio.,Inactivo,Periodo 2008-2009
1365,1cb1c36dc3e94a82bfd1435d1ff728b5,Artes,Excepturi nobis libero debitis ut ullam.,Inactivo,Periodo 2010-2011
