,id,Materia,Descripcion,Status,Periodo
3696,141e28d88d87493fb6e79be546924733,Pensamiento Matemáico,Temporibus facere atque accusantium aliquam sunt repellendus.,Inactivo,Periodo 2016-2017
3697,0d7bac517205400b91026fa3c807a5ac,Pensamiento Matemáico,Accusamus alias amet accusamus.,Inactivo,Periodo 2015-2026
3698,c7630be222a54159b41dad7b67b8289d,Pensamiento Matemáico,Reiciendis quia ex doloribus fugit necessitatibus nobis.,Inactivo,Periodo 2000-2001
3699,761a2860d1944f908d079b4a9ae9a997,Lenguaje y Comunicación,Soluta dolores aspernatur nihil.,Inactivo,Periodo 2002-2003
3700,042d3f9a8fdc4962b56fc36e2930e9d0,Artes,Quos dolores architecto quidem saepe temporibus id.,Inactivo,Periodo 2013-2014
3701,e3ac49e4a53d45c7b5c4fcebeb61a021,Educación Fisica,Sunt recusandae placeat vitae occaecati.,Inactivo,Periodo 2005-2006
3702,11992017b1e645c79ea890ce95e48a93,Educación Fisica,A eius voluptate consequatur at porro.,Inactivo,Periodo 2020-2021
3703,acb92cb223fd4b10a732a1d24a8bea63,Exploración y Comprensión del mundo natural y social,Quia doloribus dolor rem.,Inactivo,Periodo 2008-2009
3704,0cc5af505d684b46bb359e3999944713,Artes,Ipsum cupiditate tenetur ducimus culpa.,Inactivo,Periodo 2003-2004
3705,f68126525a484254b11fa309aa94024e,Lenguaje y Comunicación,Rem voluptatibus officiis aliquid recusandae optio.,Inactivo,Periodo 2004-2005
3706,ae2aa70e73374c898db720c8ca7a700e,Pensamiento Matemáico,Minima mollitia corrupti sapiente.,Inactivo,Periodo 2003-2004
3707,786f5c7c7c86444d83c288c12709c7f4,Artes,Repellendus quibusdam quasi mollitia.,Inactivo,Periodo 2005-2006
3708,801eaec00ed34158a2f821dce689ec45,Educación SocioEmocional,Eligendi consequuntur dolorem.,Inactivo,Periodo 1999-2000
3709,1b49a72fb04441e293ac8feae8d62d6c,Exploración y Comprensión del mundo natural y social,Sapiente inventore blanditiis voluptates sed.,Inactivo,Periodo 2020-2021
3710,0be7eca8d4f7417396b81b48a7c4bef4,Pensamiento Matemáico,Laboriosam eveniet non dignissimos est vitae corporis.,Inactivo,Periodo 2012-2013
3711,2c698f2d9f6c4c8fafc5b07024c016e8,Lenguaje y Comunicación,Est dolores sapiente debitis eaque.,Inactivo,Periodo 2000-2001
3712,7ba9e38a6d2b4d5984e071a45fee29a6,Exploración y Comprensión del mundo natural y social,Alias provident rerum iusto ducimus et optio.,Inactivo,Periodo 2011-2012
3713,6eb98b64346b4edaa7455ae98409f19f,Educación Fisica,Suscipit facere itaque veniam quis aperiam mollitia.,Inactivo,Periodo 2001-2002
3714,1b88a661d9ea44d0a5e4999f04ad5689,Educación SocioEmocional,Magnam provident vero fuga.,Inactivo,Periodo 2013-2014
3715,6c5e8f9af4be4bc3aef55a52751695d0,Educación Fisica,Perspiciatis cumque pariatur corrupti quibusdam quas animi atque.,Inactivo,Periodo 2005-2006
3716,5dca7eb80a114e1881a5b671692a68b7,Pensamiento Matemáico,Laudantium asperiores ratione beatae incidunt labore nemo enim.,Inactivo,Periodo 2017-2018
3717,8f4a64b5694644f7bd7b9ce9b4fdda39,Lenguaje y Comunicación,Incidunt delectus accusantium ratione.,Inactivo,Periodo 2012-2013
3718,4167a513063c49efa8dcfdc0dd4274ce,Educación Fisica,Ipsa consectetur esse.,Inactivo,Periodo 2015-2026
3719,430f975500714254b1ba8c22dfbd3cc0,Pensamiento Matemáico,Quos accusantium iure reiciendis optio id.,Inactivo,Periodo 2011-2012
3720,2fe2da1a925f43c7b91a39bba0833773,Pensamiento Matemáico,Quisquam tempora repudiandae sapiente distinctio necessitatibus nulla qui.,Inactivo,Periodo 2012-2013
3721,74cba56705cc4dc38b5a9575b00ea752,Educación Fisica,Non animi laudantium tempora error illum.,Inactivo,Periodo 2018-2019
3722,0e12454c1ecd46d1b5c23db2c4970e92,Exploración y Comprensión del mundo natural y social,Perferendis dolores consectetur accusantium illum enim necessitatibus error.,Inactivo,Periodo 2007-2008
3723,a7d570d71b704494956910641d7bcdfc,Educación SocioEmocional,Perspiciatis quaerat dicta odio nemo maxime repellendus nam.,Inactivo,Periodo 2000-2001
3724,c9e626db367643639a9610681756e6e9,Exploración y Comprensión del mundo natural y social,Porro nobis maxime quia earum necessitatibus vero.,Inactivo,Periodo 2001-2002
3725,52530e65f3b14b53be9896575dabeccd,Lenguaje y Comunicación,Eum necessitatibus praesentium quas accusamus.,Inactivo,Periodo 2015-2026
3726,87c79e1eb193447fa8aded4ef88e6a6a,Artes,Eius quidem explicabo quae reprehenderit enim sequi.,Inactivo,Periodo 2004-2005
3727,b1f1c5ff8a3a424c9ccf09b6235ad069,Artes,Fugit commodi voluptatibus.,Inactivo,Periodo 2013-2014
3728,d00f6f12ce1d48f79dcb1c17a5ffbf25,Educación SocioEmocional,Esse suscipit quis nihil illum nisi.,Inactivo,Periodo 2016-2017
3729,bb1c96350c9b42e88bf997dffaf05fd0,Pensamiento Matemáico,Harum perferendis provident illo vero deleniti.,Inactivo,Periodo 2001-2002
3730,ab0752433b4b448596e0d54b24ba77b1,Pensamiento Matemáico,Eius temporibus laudantium molestias soluta quaerat.,Inactivo,Periodo 2008-2009
3731,b6f86ba81f584a869a637fbdf8121024,Artes,Facere doloremque sint.,Inactivo,Periodo 2001-2002
3732,15927cb8dc92471ca2da2155275e5310,Exploración y Comprensión del mundo natural y social,Nam necessitatibus quis quibusdam modi omnis quasi.,Activo,Periodo 2022-2023
3733,43f9cd37cd9e4a749ddd2ae6f425d26e,Exploración y Comprensión del mundo natural y social,Ea exercitationem ea ullam debitis.,Inactivo,Periodo 2011-2012
3734,5a7cc1e7cc2140cda0c75a90dfa4408f,Artes,Velit ab ullam alias accusamus alias.,Inactivo,Periodo 2018-2019
3735,16e27c9642fd47be9981bcb58001b302,Educación SocioEmocional,Sint laudantium assumenda dolor earum natus voluptates et.,Inactivo,Periodo 2019-2020
3736,67fb70266bdf4b87925c515f9dd6aa8b,Artes,Fugit accusantium tempore deleniti.,Inactivo,Periodo 2014-2015
3737,f4f1600d9bcc4cfba87957b80838a3e6,Educación Fisica,Ut aut quam mollitia eum vero.,Inactivo,Periodo 2014-2015
3738,b018a1148809405d8f7c377c1be5eb39,Artes,Vitae deserunt totam modi maxime.,Inactivo,Periodo 2021-2022
3739,3fb29c17b2f44b72b62ff157c307a42b,Pensamiento Matemáico,Aliquid debitis dolore aspernatur maiores totam.,Activo,Periodo 2022-2023
3740,02ba48a9651e47e0ba584c61c2701b57,Pensamiento Matemáico,Illum in rem molestias.,Inactivo,Periodo 2016-2017
3741,117ee4363ea6465081b19dbd4ff81c2d,Artes,Sunt ipsam voluptate ullam modi.,Inactivo,Periodo 2009-2010
3742,49fd2f9da0f3453b9bf54f81b038e6e3,Artes,Unde vitae eius iste.,Inactivo,Periodo 2020-2021
3743,77312595ea21403a95c562a015c3428c,Lenguaje y Comunicación,Dolorem quas dolore laudantium.,Inactivo,Periodo 2016-2017
3744,71c145c676144b7e88a662b536b2e624,Lenguaje y Comunicación,Ad quam explicabo eligendi quidem.,Inactivo,Periodo 2000-2001
3745,412c5993005c43409bb95f68a2a8659c,Educación Fisica,Perferendis ipsa cum.,Inactivo,Periodo 2012-2013
3746,a8cfabae7dbe4bfc8950ca2417020bb9,Artes,Alias dolorum unde officia doloremque architecto.,Inactivo,Periodo 2012-2013
3747,8fec2dadef804903af8d92962068fffa,Exploración y Comprensión del mundo natural y social,Ullam error deleniti ipsam aliquam ut harum.,Inactivo,Periodo 2016-2017
3748,b54dbe56d95b4165a7326e91abc061da,Exploración y Comprensión del mundo natural y social,Eligendi voluptatem doloribus eius impedit.,Activo,Periodo 2022-2023
3749,8207523f173e4d96898ec054ed3facf9,Artes,Optio corrupti ab.,Inactivo,Periodo 1999-2000
3750,10629a54bd914725a5febe7953a341e8,Lenguaje y Comunicación,Ab rerum molestias sunt sed consequatur rem eos.,Inactivo,Periodo 2006-2007
3751,52770269c2494640bd3233870bbea884,Exploración y Comprensión del mundo natural y social,Eveniet ut modi quaerat amet laborum vero aliquam.,Inactivo,Periodo 2012-2013
3752,dd8748575c1a49969aef58bd70bfd345,Educación SocioEmocional,Ipsa accusantium ad ullam quod dolore.,Inactivo,Periodo 2019-2020
3753,5597fdec50064d45955d4bced647e8d4,Exploración y Comprensión del mundo natural y social,Aut magni ipsa.,Inactivo,Periodo 2005-2006
3754,a5e2f0c266c54ee2a355f7ce612210c9,Lenguaje y Comunicación,Consequuntur exercitationem excepturi.,Inactivo,Periodo 2014-2015
3755,47642778150b40fabf2378c57127edd8,Pensamiento Matemáico,Incidunt blanditiis et perspiciatis aliquam incidunt asperiores.,Inactivo,Periodo 2010-2011
3756,f440132590a34a8c980008e6a7db4622,Lenguaje y Comunicación,Iure fugiat maxime non in dignissimos ducimus.,Inactivo,Periodo 2007-2008
3757,643dfc7d80bc48288ccda7456b308e43,Educación SocioEmocional,Natus beatae dicta nesciunt.,Activo,Periodo 2022-2023
3758,b72d6d8b795b4576936a074d1b3b7062,Educación SocioEmocional,Repellat tenetur expedita nesciunt.,Inactivo,Periodo 2012-2013
3759,ba3c5d0bd03842b49475c80beb663ca2,Exploración y Comprensión del mundo natural y social,Perspiciatis quisquam fuga aspernatur explicabo distinctio.,Inactivo,Periodo 2018-2019
3760,0253e6b6c34a4d2daf3fbfccfdd78f24,Artes,Quos voluptate dolor repellat nulla reiciendis.,Activo,Periodo 2022-2023
3761,9269056dcd8d46f9a73de705bf53dfe4,Educación SocioEmocional,Accusamus officia deleniti maxime aliquid aspernatur expedita.,Inactivo,Periodo 2019-2020
3762,733cca38a7a042afacfb1d1013bf3c3e,Pensamiento Matemáico,Perspiciatis laborum sapiente deserunt velit nobis.,Inactivo,Periodo 1999-2000
3763,c9f9d9a4ee064d30bb65c328ef510de0,Artes,Quae quidem laboriosam adipisci.,Inactivo,Periodo 2019-2020
3764,712c4e2cc6104a35b6f6d69df17d3d7e,Lenguaje y Comunicación,Id dignissimos tempore.,Inactivo,Periodo 2017-2018
3765,c7931e36e5684d30be405c57880452e9,Educación SocioEmocional,Sequi earum sapiente dicta a provident reprehenderit.,Inactivo,Periodo 2017-2018
3766,a5160dc79f39431e9fd0cd067b89f311,Educación SocioEmocional,Nam recusandae fugit ipsa.,Inactivo,Periodo 2000-2001
3767,8c5abfe34d1947d0948ed27da3b94442,Educación Fisica,Iusto in fugit natus numquam ea.,Inactivo,Periodo 2006-2007
3768,cc8b5621d5684313ba3f0a7bdb080203,Educación Fisica,Blanditiis sequi recusandae vitae.,Inactivo,Periodo 2017-2018
3769,57894e5ff23144e38df993bf9ce85df1,Pensamiento Matemáico,Laudantium repellat ducimus magni.,Inactivo,Periodo 2019-2020
3770,34d7c71e0f504132bf4b8f5a988ef9d3,Artes,Architecto dolorum cumque corrupti.,Inactivo,Periodo 2018-2019
3771,2272d1a60c514d9da8ca6fb5fedf28f2,Pensamiento Matemáico,Eum consectetur repudiandae numquam placeat eius est.,Inactivo,Periodo 2002-2003
3772,c6cf1c16ecdb49b6a6908f9efbbb5f10,Educación SocioEmocional,Consequuntur ab nemo autem tenetur labore dicta.,Inactivo,Periodo 2001-2002
3773,fe1821ed850248698e01d1ec41e7f6f4,Educación SocioEmocional,Asperiores officiis sit.,Inactivo,Periodo 2002-2003
3774,f8ebaecad6d047dda6712b62d00d725e,Pensamiento Matemáico,Neque cupiditate inventore numquam sed doloribus.,Inactivo,Periodo 2016-2017
3775,7e715ba5c7bd4394a0ccb6e9bf5abb39,Lenguaje y Comunicación,Natus unde id sed enim.,Inactivo,Periodo 2019-2020
3776,c0aac075a96146f0bb84371758ea7af8,Educación SocioEmocional,Tempora architecto qui ipsa corrupti.,Inactivo,Periodo 2017-2018
3777,f76eec21a90144e2ae2905fed782e20e,Educación Fisica,Beatae nulla doloribus quibusdam impedit assumenda ullam mollitia.,Inactivo,Periodo 2018-2019
3778,a51deae4d4714a8f84a234c04ef7f92b,Pensamiento Matemáico,Nobis odio aut id inventore.,Inactivo,Periodo 2003-2004
3779,bb4e9ed21b2748e3bc33a1ffa0cc943b,Educación SocioEmocional,Aut eum amet placeat natus expedita totam.,Inactivo,Periodo 2002-2003
3780,f061741b834449feb29eabc2b2cdcd59,Educación Fisica,Doloribus explicabo recusandae facere vero pariatur.,Inactivo,Periodo 1999-2000
3781,44606827aac848c6838ad89ec689dc3d,Educación Fisica,Necessitatibus enim impedit.,Inactivo,Periodo 2018-2019
3782,eb8064f24ad94ba78fe7c2a2282df5f2,Educación SocioEmocional,Pariatur doloremque blanditiis ipsum.,Inactivo,Periodo 2004-2005
3783,678fc0da04d9448fa74c644fbf5b471c,Pensamiento Matemáico,Modi animi cupiditate labore harum.,Inactivo,Periodo 2002-2003
3784,5de9642708bf4a718e554754ff3d066f,Lenguaje y Comunicación,Quam tenetur non animi nesciunt temporibus culpa sit.,Inactivo,Periodo 2016-2017
3785,ddd7841694c240bfb60310258113b83b,Pensamiento Matemáico,Harum alias consequatur nesciunt eveniet velit.,Inactivo,Periodo 2008-2009
3786,eccdf2fed1164b259055049567441562,Educación SocioEmocional,Sed temporibus corporis deserunt quam nobis.,Inactivo,Periodo 2002-2003
3787,8052ab1e50774686bc67c79c3d96d740,Educación Fisica,Vitae architecto beatae dicta eligendi.,Inactivo,Periodo 2021-2022
3788,3f0153bc7e3047539f709f820c1ab95a,Educación Fisica,Vero sint laboriosam veniam iusto reprehenderit sed.,Inactivo,Periodo 2012-2013
3789,564dabdc9b8b40b8a891e63c5ed9c585,Lenguaje y Comunicación,Molestias voluptatem quo nulla fuga corrupti.,Inactivo,Periodo 2016-2017
3790,79964d19b9ca440a988b16c3c18e318a,Exploración y Comprensión del mundo natural y social,Veniam commodi illum sequi fugit.,Inactivo,Periodo 2016-2017
3791,c907ddc8f6ee496496d8517eac32942f,Educación SocioEmocional,Provident officiis accusamus repellendus tenetur architecto aspernatur nulla.,Inactivo,Periodo 2019-2020
3792,3e227623172e40938f48b81d5e472734,Exploración y Comprensión del mundo natural y social,Nulla quia itaque eveniet enim.,Inactivo,Periodo 2012-2013
3793,c1fd6e8707b6411ebf2ab21f6cd88850,Lenguaje y Comunicación,Quam asperiores ullam nostrum.,Inactivo,Periodo 2008-2009
3794,7bc2f037f09242b7898defd307453d0b,Educación SocioEmocional,Ipsum tempore ratione aut quasi veritatis ipsam.,Inactivo,Periodo 2015-2026
3795,4062da01cab043369f7f5d3f226b3d27,Exploración y Comprensión del mundo natural y social,Molestiae inventore tempore.,Inactivo,Periodo 2019-2020
3796,727ccdd5737d4ec28541c9a764ccd9dc,Artes,Maxime aliquam molestiae maxime saepe dolorem.,Inactivo,Periodo 2013-2014
3797,7fc1c0dec49f4d79a91173d1d8295620,Educación SocioEmocional,Quod voluptate quae nihil veniam.,Inactivo,Periodo 2002-2003
3798,96e823fad49248e2b4977b54e9112975,Artes,Dolorum animi omnis beatae similique doloribus dicta.,Inactivo,Periodo 2021-2022
3799,10af6120558744259dcbcebe214f35fd,Educación SocioEmocional,Quasi repellendus aperiam excepturi voluptates asperiores praesentium.,Inactivo,Periodo 2006-2007
3800,38b04f39a40b4cfda98485685fa6221f,Pensamiento Matemáico,Totam quaerat totam temporibus incidunt quod.,Inactivo,Periodo 2004-2005
3801,5d9cd802d0464cddb6b9da77a85a555b,Lenguaje y Comunicación,Reprehenderit accusamus blanditiis nobis tempora.,Inactivo,Periodo 2005-2006
3802,102096b48c194e78b6d8eb0e73d01879,Educación Fisica,Cum animi itaque nostrum.,Inactivo,Periodo 2018-2019
3803,e43dd2b55d3b4ada964503660ed8f78a,Educación Fisica,Ad mollitia harum quos vero.,Activo,Periodo 2022-2023
3804,18bb06e02f9f489096f87cadd539fd77,Lenguaje y Comunicación,Modi molestiae pariatur veritatis dignissimos error reiciendis.,Inactivo,Periodo 2004-2005
3805,6f45ed49b6c14466add59d001d72f739,Educación Fisica,Eveniet molestiae minus.,Inactivo,Periodo 2019-2020
3806,b4af476198274d68b9c87db16d0e4c64,Artes,Qui blanditiis eius maiores quasi doloremque.,Inactivo,Periodo 2014-2015
3807,d90c8822a59149d8a7f4daab359a9c66,Artes,Veritatis nostrum aperiam.,Inactivo,Periodo 2003-2004
3808,e69fb3a1d2f749c9b95e524e7023b2be,Educación SocioEmocional,Incidunt consequatur iste eligendi aspernatur.,Inactivo,Periodo 2011-2012
3809,09fd5c70f7bf42ceb3d097618d10ed41,Educación SocioEmocional,Atque amet illo rerum quo corrupti blanditiis.,Inactivo,Periodo 2005-2006
3810,1b00f9d82c784b0da2452ae28b514ec5,Lenguaje y Comunicación,Iste occaecati recusandae officiis consectetur voluptas.,Inactivo,Periodo 2005-2006
3811,7b4cd3d16880496e9cb9e57f8628a60f,Educación SocioEmocional,Maxime eos sapiente totam similique iure.,Inactivo,Periodo 2005-2006
3812,1571400bb2c449a7b3f1cd0a758fffa3,Pensamiento Matemáico,Provident aut nam dolor.,Inactivo,Periodo 2021-2022
3813,6636768e94a54e9da72eb4039e8879d2,Exploración y Comprensión del mundo natural y social,Dolore quo corrupti quasi doloremque eveniet et.,Inactivo,Periodo 2014-2015
3814,d44d46bfa28f4186bc78299469ebc6c6,Lenguaje y Comunicación,Reprehenderit officiis voluptates quam.,Inactivo,Periodo 2004-2005
3815,c0b562b155584232adddbbd9ee4653c5,Educación Fisica,Laboriosam adipisci commodi quis.,Inactivo,Periodo 2017-2018
3816,a2354100c93349f995a48afd3759f39a,Lenguaje y Comunicación,Ipsa molestias libero mollitia suscipit sequi.,Inactivo,Periodo 2007-2008
3817,c07602ed0b80414dbbcd39bada51c41f,Lenguaje y Comunicación,Quo quas at nesciunt atque at quis.,Inactivo,Periodo 2007-2008
3818,02398dd60e154578ad78b032b552186b,Pensamiento Matemáico,Aspernatur eius praesentium consequatur molestiae velit porro.,Inactivo,Periodo 2004-2005
3819,7dfcdf3b992345359064a659ca2eef59,Lenguaje y Comunicación,Reprehenderit vero numquam iste.,Inactivo,Periodo 2009-2010
3820,0e4db247d75d4ff2be46ce080c7cc561,Educación SocioEmocional,Pariatur eum delectus ullam maxime suscipit perferendis sint.,Activo,Periodo 2022-2023
3821,69ab1d8000554218b8647bd12a155087,Pensamiento Matemáico,Asperiores alias cum voluptatum recusandae est.,Inactivo,Periodo 2019-2020
3822,283d8eb9f7e54bc0940423b95a969462,Exploración y Comprensión del mundo natural y social,Odit autem illum suscipit.,Inactivo,Periodo 1999-2000
3823,126bdf0897b64c2980bdf757d98c38a2,Educación SocioEmocional,Quos quas accusamus omnis vitae quibusdam quasi doloremque.,Inactivo,Periodo 2017-2018
3824,c3bbec2ba6a34ee4be44c2f74f5b6b8f,Pensamiento Matemáico,Facilis vero a earum nisi delectus voluptatibus.,Inactivo,Periodo 2016-2017
3825,fd68c4280092442bb426e6f6d633c693,Artes,Optio enim dicta temporibus tempore quae accusantium mollitia.,Inactivo,Periodo 2006-2007
3826,c3baae6bf4ff4a42820246bd789b7db5,Educación Fisica,Commodi ipsum totam rerum excepturi reiciendis beatae.,Inactivo,Periodo 2009-2010
3827,0b101f7fa3dc4c718cb7963428fcb5af,Lenguaje y Comunicación,Quia dolore excepturi at quas est.,Inactivo,Periodo 2015-2026
3828,808cdaf1b14f4b12a72c9dc9b30eb890,Exploración y Comprensión del mundo natural y social,Vero officia dolor itaque dicta labore.,Inactivo,Periodo 2016-2017
3829,cd47c7497f73493aa634cf7768074391,Educación SocioEmocional,Facilis velit placeat reprehenderit.,Inactivo,Periodo 2004-2005
3830,8a6268f33ba3410999327d5076f8cdb2,Exploración y Comprensión del mundo natural y social,Velit culpa laborum dicta suscipit error maiores.,Inactivo,Periodo 2003-2004
3831,a39770b9384042f4acac2ca0bfbb4005,Pensamiento Matemáico,Incidunt amet quibusdam animi.,Inactivo,Periodo 2019-2020
3832,06e1242ce67a456db3d36e2ba44dd1d7,Artes,Animi quam alias dolor est sunt.,Inactivo,Periodo 2008-2009
3833,1943f87ab26040dab1caaa9b176f6ffd,Educación Fisica,Sed sed eum aliquam odio.,Inactivo,Periodo 2008-2009
3834,5be26d23bf664fb9a1f3da1f3cabb5fe,Exploración y Comprensión del mundo natural y social,Quisquam esse quaerat sunt nihil.,Inactivo,Periodo 2021-2022
3835,3d53592a0498491f84413da038ffb62f,Exploración y Comprensión del mundo natural y social,Cupiditate vitae impedit nam nemo enim neque quaerat.,Inactivo,Periodo 2019-2020
3836,7d3c0d26823948308f62ccef736ffe4b,Artes,Harum dicta rerum id quaerat quia sapiente.,Inactivo,Periodo 2010-2011
3837,aabfa078c985417d83eff0bfb3e922da,Pensamiento Matemáico,Eos expedita nihil ducimus libero et culpa.,Inactivo,Periodo 2021-2022
3838,cd1c6a40abf1442ba31fd316a6ab9846,Exploración y Comprensión del mundo natural y social,Mollitia provident quos similique ex beatae dicta.,Inactivo,Periodo 2007-2008
3839,ac48be6122704b279e9ce484a2e62e7a,Artes,Eveniet eaque quae dolore inventore ea consequatur.,Inactivo,Periodo 2010-2011
3840,2979bec859374e79975ce2a7cf775aa0,Educación Fisica,Dolores optio ea hic vel.,Inactivo,Periodo 2016-2017
3841,46c89c18aefd4591830416e4a7819153,Lenguaje y Comunicación,Doloremque exercitationem omnis iure qui laborum fuga.,Activo,Periodo 2022-2023
3842,64876401bd704791a52f0fdd7fe8bdfc,Educación Fisica,Excepturi nesciunt excepturi sed illo consequuntur.,Inactivo,Periodo 2018-2019
3843,f207cbb4bc1c4c7888fe48f05753ae6e,Exploración y Comprensión del mundo natural y social,Placeat quia nesciunt pariatur fugit officia ea.,Inactivo,Periodo 2017-2018
3844,ccdf0457e78145c2b1e2ab2b82ca1365,Exploración y Comprensión del mundo natural y social,Eveniet tempore sapiente pariatur numquam eaque.,Inactivo,Periodo 2008-2009
3845,e9a5754b1d324068b49102938a158c47,Pensamiento Matemáico,Quod impedit totam ipsum consectetur quasi eos.,Inactivo,Periodo 2016-2017
3846,9a3b2b76846d4b73a7cce2fc5da26e75,Artes,Nobis corporis vitae vitae voluptatibus magni necessitatibus.,Inactivo,Periodo 2003-2004
3847,fc3b244654e2415786b2adf6e80119a5,Educación SocioEmocional,Iusto perferendis non libero aliquid blanditiis dolorum.,Inactivo,Periodo 1999-2000
3848,fed6f9604f334828bc1d7dfab85e3aff,Pensamiento Matemáico,Et molestias fugit eveniet repellendus architecto quod.,Inactivo,Periodo 2010-2011
3849,313d29cd224a4080b806854f2ec04fc2,Educación SocioEmocional,Fugiat totam aliquid nam laudantium illum incidunt.,Inactivo,Periodo 2012-2013
3850,111e9d28bc924893a80f9d39cc9a0037,Educación SocioEmocional,Rem quod voluptas velit magnam voluptas corporis.,Inactivo,Periodo 2014-2015
3851,0ccf0317d1d2433cae6d68740f969de5,Educación SocioEmocional,Neque magni vel nisi.,Inactivo,Periodo 2006-2007
3852,78b0aa46ce2a4c5f81c965af1919c5a5,Educación Fisica,Fuga neque impedit sapiente quibusdam sint quaerat.,Inactivo,Periodo 2008-2009
3853,539c9cce938548279148eb057bcee999,Educación Fisica,Qui deleniti impedit quos dolore quos.,Inactivo,Periodo 2019-2020
3854,6010e1b174804e0ba7313cbfc7439527,Educación SocioEmocional,Laborum assumenda explicabo adipisci labore sit molestias.,Inactivo,Periodo 2013-2014
3855,a205cca0e58645fca330bcdfaf4d01d1,Educación Fisica,Voluptates nemo maiores.,Inactivo,Periodo 2001-2002
3856,6cf2c921ddcf479ca48beb4064bd2c52,Educación SocioEmocional,Ad a modi cupiditate accusantium autem.,Inactivo,Periodo 2002-2003
3857,d63c7974fbed4698ad503f2b050d743b,Educación Fisica,Ex voluptatem molestiae iste quod ullam sint tempora.,Inactivo,Periodo 2016-2017
3858,99f5cb8ca672414d80932fd33e8de01e,Lenguaje y Comunicación,Doloribus nisi maiores deleniti eos inventore neque.,Inactivo,Periodo 2021-2022
3859,4c1562cf74784cd8a4e26080e98ac03d,Educación SocioEmocional,Architecto recusandae in odit.,Inactivo,Periodo 2019-2020
3860,7e3db18cb2ae43febcd2d9b31388a44a,Exploración y Comprensión del mundo natural y social,Iste dolorum maiores quaerat.,Inactivo,Periodo 2020-2021
3861,f1549a7041dc40a58b7f4e02879ac44b,Educación Fisica,Magnam a consequatur eius temporibus aspernatur in.,Inactivo,Periodo 2010-2011
3862,7ff7c800f0a4496fb19283f48e825cd7,Lenguaje y Comunicación,Ipsum iusto reprehenderit explicabo odit.,Inactivo,Periodo 2010-2011
3863,83febbe1848d4b1eac55c8f23cfc85c3,Educación SocioEmocional,Rem quisquam earum sapiente illum cumque provident animi.,Inactivo,Periodo 2009-2010
3864,a99f0ca8100e4556928ec49f37f91ae9,Exploración y Comprensión del mundo natural y social,Iure accusamus natus blanditiis.,Inactivo,Periodo 2000-2001
3865,276d9322803b433c8632d3ec15106fee,Exploración y Comprensión del mundo natural y social,Tenetur ad assumenda corrupti velit libero commodi.,Inactivo,Periodo 2005-2006
3866,6c7ced9f41224c5fa3b1f596025720c0,Lenguaje y Comunicación,Est pariatur consequuntur voluptate accusantium.,Inactivo,Periodo 2005-2006
3867,105e6ad138e64031ad21544a9e28e6c6,Educación Fisica,Ex illo quis aperiam odit culpa odio eligendi.,Inactivo,Periodo 2010-2011
3868,3b96a99f31dd45acb499c01c2e90c8b5,Educación SocioEmocional,Voluptatum deserunt suscipit quo.,Inactivo,Periodo 2016-2017
3869,2422d913a210429289dfe564dded9e88,Artes,Nisi numquam possimus quo delectus repellat aspernatur.,Inactivo,Periodo 2006-2007
3870,c273cb071d65482bb83c8175f07b44c1,Exploración y Comprensión del mundo natural y social,Eligendi commodi molestiae ipsum nulla.,Inactivo,Periodo 2019-2020
3871,138b9da16c3442a397e7095d104371fe,Lenguaje y Comunicación,Doloribus voluptates neque iste.,Inactivo,Periodo 2000-2001
3872,3407ebb91066426ab5c53cf3cf5188da,Artes,Quas magni voluptas dolor nam.,Inactivo,Periodo 2015-2026
3873,03700ba284cd4edf8818997d44c32427,Educación SocioEmocional,Placeat veritatis error itaque.,Inactivo,Periodo 2018-2019
3874,4827543541174eea90a683b0d4d1814a,Lenguaje y Comunicación,A quos soluta vel perferendis adipisci excepturi.,Inactivo,Periodo 2001-2002
3875,76532f382daf43708e5103488c25c9d1,Educación SocioEmocional,Totam eum omnis quibusdam provident.,Inactivo,Periodo 2012-2013
3876,606c51734d06470fbdc55ece0203ebcc,Educación SocioEmocional,Ea ab qui.,Inactivo,Periodo 2017-2018
3877,ce94b15791df45db9eb83062bc3c81f8,Exploración y Comprensión del mundo natural y social,Laborum iure commodi ea officia culpa.,Inactivo,Periodo 2000-2001
3878,26b654805f5248e8b9e438bf5d364a9f,Pensamiento Matemáico,Voluptatem quo ex maxime.,Inactivo,Periodo 2019-2020
3879,481b32759f7f4767aecd40faf78514a9,Pensamiento Matemáico,Debitis iste id mollitia voluptatum id.,Inactivo,Periodo 2004-2005
3880,7bd6bb90015c4de4b1ad20de942ec317,Educación Fisica,Consectetur labore tenetur illum facere.,Inactivo,Periodo 2016-2017
3881,f67424adfcd742ee9a4a0ea278822945,Lenguaje y Comunicación,Ullam placeat dolore quae itaque.,Inactivo,Periodo 2008-2009
3882,a1c100f70bc441fdba2ade1ed071ed48,Lenguaje y Comunicación,Quos dolor culpa eligendi modi.,Inactivo,Periodo 2007-2008
3883,3d2846663470499d8ff021dfea51d640,Pensamiento Matemáico,Fuga pariatur nisi commodi a optio velit.,Inactivo,Periodo 2018-2019
3884,84e9becf73384b96941a4841e304a56f,Exploración y Comprensión del mundo natural y social,Perferendis magni ipsam iusto.,Inactivo,Periodo 2014-2015
3885,469b12015c8049b19fcdb8621092c9aa,Lenguaje y Comunicación,Autem expedita provident natus.,Inactivo,Periodo 2021-2022
3886,f20d4fc8877f477591b14e01c255234f,Pensamiento Matemáico,Earum quis eius rerum.,Inactivo,Periodo 2003-2004
3887,e6d86c4988af45f1885bda3397947ca3,Educación SocioEmocional,Quidem consequuntur amet quia eos reprehenderit nulla.,Inactivo,Periodo 2006-2007
3888,da29fc8d12da4c6ba4d86a034f9ad0bc,Educación SocioEmocional,Nostrum laboriosam atque magnam.,Inactivo,Periodo 2000-2001
