,id,Materia,Descripcion,Status,Periodo
2338,42b35b27655847f5bfa1d137c311edc1,Lenguaje y Comunicación,Quae illo excepturi ducimus fugiat doloribus.,Inactivo,Periodo 2018-2019
2339,dc2904aee6b04ed79a448461c1e05a46,Educación SocioEmocional,Libero est corrupti doloremque amet maxime.,Inactivo,Periodo 2001-2002
2340,0cccbe7157b24f4ca77f359181f75725,Lenguaje y Comunicación,Non inventore neque vero aliquid.,Inactivo,Periodo 2019-2020
2341,15c9a3a20b0148aeb42015d0b404696f,Lenguaje y Comunicación,Vitae pariatur consequuntur fugit.,Inactivo,Periodo 2013-2014
2342,76724955fbb641f089798c5401ed1475,Pensamiento Matemáico,Officiis soluta a tempore nobis libero.,Inactivo,Periodo 1999-2000
2343,688a03ab08854fbb946a93ece3ca36e1,Educación SocioEmocional,Ex eum totam natus.,Inactivo,Periodo 2016-2017
2344,40ce10fda8344ec385bddc46b6acbee1,Pensamiento Matemáico,Sint consectetur excepturi corporis eveniet laudantium eum.,Inactivo,Periodo 2007-2008
2345,f7f3eaa636ea4ef8950e7da7f7d209a5,Lenguaje y Comunicación,Consequatur veniam aspernatur explicabo quos iste eum.,Inactivo,Periodo 2009-2010
2346,6ac5880c31d44096b879ac01772fd26e,Pensamiento Matemáico,Nostrum numquam praesentium eveniet tempora quibusdam asperiores.,Inactivo,Periodo 2018-2019
2347,09bc07438c144af0be49588ff3c46e59,Lenguaje y Comunicación,Culpa explicabo blanditiis eveniet in ex.,Inactivo,Periodo 2004-2005
2348,a7842d98b2f843cb9f570c874bebbe06,Lenguaje y Comunicación,Aliquam aspernatur rem autem quis id nostrum.,Inactivo,Periodo 2015-2026
2349,450a249c10bb415abe029e428a0d9317,Educación Fisica,Eaque facilis recusandae itaque quibusdam fuga.,Inactivo,Periodo 2021-2022
2350,af8408ab8f094b86a08776346cf50511,Exploración y Comprensión del mundo natural y social,Quidem eligendi similique consequatur.,Inactivo,Periodo 2014-2015
2351,223a683e29e0443bbd54d029bde2742b,Pensamiento Matemáico,Voluptate commodi animi quidem a tenetur blanditiis.,Inactivo,Periodo 2010-2011
2352,e8d54c579cf848dbb9119434e4ed4e13,Educación SocioEmocional,Provident voluptate officiis expedita laboriosam.,Inactivo,Periodo 2000-2001
2353,e30262918ac64837b1270abd3d73bf65,Exploración y Comprensión del mundo natural y social,Accusantium veniam architecto eaque hic blanditiis.,Inactivo,Periodo 2003-2004
2354,843dcd4f25eb4357a47081748bc56f89,Artes,Molestias excepturi repudiandae rem.,Inactivo,Periodo 2005-2006
2355,c56fbe27f57f475da892d781823e9e1e,Educación SocioEmocional,Iste consequuntur laudantium nesciunt nemo dolores.,Inactivo,Periodo 2019-2020
2356,140242aad9074f238dc28a3a8edba012,Pensamiento Matemáico,Dolorum reiciendis nam maiores recusandae.,Inactivo,Periodo 2008-2009
2357,11a41753e76c420798daa2129265e926,Educación Fisica,Consectetur ipsum maxime delectus repellat.,Inactivo,Periodo 2002-2003
2358,86d0b15924114f9681a4918bfb07d0c9,Pensamiento Matemáico,Voluptates doloremque nulla nemo.,Inactivo,Periodo 2017-2018
2359,90d558d122254d168155e440003b67d4,Educación Fisica,Accusantium autem esse placeat amet.,Inactivo,Periodo 2002-2003
2360,e128a2ac988c4c809eb9867cd016513b,Lenguaje y Comunicación,Mollitia quaerat asperiores officia nihil.,Inactivo,Periodo 2002-2003
2361,d68b51c7fb004ec196604c25f4654fa4,Pensamiento Matemáico,Cupiditate occaecati dolores quas provident officiis.,Inactivo,Periodo 2006-2007
2362,10d95691bb6e4fc2b472f4a3842068f9,Pensamiento Matemáico,Voluptas sed ullam sapiente.,Inactivo,Periodo 2005-2006
2363,cf4420783b2b4697be1be1882950798d,Exploración y Comprensión del mundo natural y social,Eveniet facilis dicta deserunt quia culpa nihil delectus.,Inactivo,Periodo 2010-2011
2364,06709cbaae984006bf54e9f4090ee218,Artes,Quas fugit tempore sint.,Inactivo,Periodo 2020-2021
2365,bd6fd0c31ea54fe3a992fc210213f61b,Artes,A vero quibusdam sit earum doloribus sed mollitia.,Inactivo,Periodo 2012-2013
2366,3459e43d7c5e4fef98e9fd68e73a8aa3,Lenguaje y Comunicación,Odio veritatis rem deserunt pariatur.,Inactivo,Periodo 2007-2008
2367,acc110e7bc8c4066a7c3b94839c2d2ad,Pensamiento Matemáico,Tenetur maxime iure eveniet reiciendis aliquam nihil.,Inactivo,Periodo 2009-2010
2368,ae76cb70dd334406948f69d36368fec1,Educación SocioEmocional,Voluptatibus deleniti nostrum ea voluptatem.,Inactivo,Periodo 2005-2006
2369,f1cb835601044f1b9ca18c1bfc0ceaf4,Lenguaje y Comunicación,Amet incidunt modi officia ipsa.,Inactivo,Periodo 2008-2009
2370,fe635ebc466d4bfd8136c3c8bcde5f31,Exploración y Comprensión del mundo natural y social,Culpa maxime dolor praesentium.,Inactivo,Periodo 2015-2026
2371,c7d00344562f4f3f9ecfff1b543fc12a,Exploración y Comprensión del mundo natural y social,Numquam ipsa aliquam omnis.,Inactivo,Periodo 2002-2003
2372,05e2bdf8afcf4eed86bb651f3caa86d5,Educación SocioEmocional,Excepturi soluta tempore accusamus consequuntur laboriosam.,Inactivo,Periodo 2001-2002
2373,e555ac23244341e9b41dba987cc21c1c,Exploración y Comprensión del mundo natural y social,In quaerat quo nostrum debitis nihil.,Inactivo,Periodo 2012-2013
2374,82be9b559ecf4a02b02ec6e0759f9272,Artes,Atque quis voluptas alias.,Inactivo,Periodo 2006-2007
2375,0e3caad29b52412b9da075ff772684b4,Educación Fisica,Ad molestias a laborum expedita repellendus.,Inactivo,Periodo 2003-2004
2376,85dd51997cc249b7939e8a2b434f9ded,Exploración y Comprensión del mundo natural y social,Numquam commodi consequatur animi cupiditate cumque.,Inactivo,Periodo 2003-2004
2377,b905e587d3004a1cafb5f0658aea2e7e,Artes,Quidem asperiores a cumque at laborum.,Inactivo,Periodo 2015-2026
2378,9bc33cd9dfa44a6ab198f7b5b4fe6719,Pensamiento Matemáico,Nesciunt quidem quos possimus neque consequatur.,Inactivo,Periodo 2018-2019
2379,a947e1ea21ff4253b9bd29316fc29cbe,Exploración y Comprensión del mundo natural y social,Corporis esse dolorum ipsam.,Inactivo,Periodo 2004-2005
2380,3da712cc4b6e4af38c5bb13aad206581,Educación Fisica,Officiis non hic necessitatibus cum ullam quibusdam.,Inactivo,Periodo 2000-2001
2381,a0b9b3189a6f404dab62c95e56aad794,Lenguaje y Comunicación,Provident voluptates aspernatur numquam eveniet asperiores facere.,Inactivo,Periodo 2013-2014
2382,e6713dd58ef449f39201d6495efe3379,Artes,Repudiandae eligendi facilis sequi.,Inactivo,Periodo 2018-2019
2383,01960a7f5b3148ef88e80ec2cc9eead0,Exploración y Comprensión del mundo natural y social,Reprehenderit dolores inventore facere voluptate minima.,Inactivo,Periodo 2001-2002
2384,b36be26acb484f7387bc3e384d884376,Educación Fisica,Necessitatibus ratione cum sit dolore.,Inactivo,Periodo 2017-2018
2385,484e16a4e62642e596dc1e1592d1011b,Exploración y Comprensión del mundo natural y social,Fugiat eos quia iste.,Inactivo,Periodo 2010-2011
2386,22ab583d2e2c4257ac8a061c95932889,Exploración y Comprensión del mundo natural y social,Doloribus iste architecto corrupti corporis cumque error.,Inactivo,Periodo 2006-2007
2387,147f7349efac44f0a776f57b690270e4,Educación SocioEmocional,Vitae cupiditate accusamus sed.,Inactivo,Periodo 2010-2011
2388,c3f50a3fd0374a79b4b2324f5aca8467,Exploración y Comprensión del mundo natural y social,Recusandae voluptate rerum vero illo aut blanditiis.,Inactivo,Periodo 2010-2011
2389,6d8ee8a01e224a9b8343364695fabae0,Lenguaje y Comunicación,Vel pariatur debitis quo perferendis omnis eum.,Inactivo,Periodo 2019-2020
2390,27a976bd5a4441aa9f692cdb38410b2d,Lenguaje y Comunicación,Nostrum animi quo recusandae porro delectus deserunt.,Inactivo,Periodo 2000-2001
2391,2119bc05534a45ff90ccf95354efc949,Lenguaje y Comunicación,Sit similique reiciendis veritatis pariatur delectus ratione tempora.,Inactivo,Periodo 2002-2003
2392,556102bf225f40b2b2ff342916c8c587,Lenguaje y Comunicación,Impedit cum nihil odio.,Inactivo,Periodo 2015-2026
2393,ed2ecae9b255453ebb8114d2c010e799,Artes,Expedita ullam vero at eligendi.,Activo,Periodo 2022-2023
2394,c899aa2c7a92429e9715d65d69b7bec6,Lenguaje y Comunicación,Libero rerum animi occaecati.,Inactivo,Periodo 2008-2009
2395,b322423e6fcd4e0d90e358f9f37633c6,Pensamiento Matemáico,Nisi adipisci eos labore nam molestiae.,Inactivo,Periodo 2014-2015
2396,202fbf29937b45cbaebdf90fdfcb21e4,Lenguaje y Comunicación,Nesciunt fugiat assumenda consequatur veritatis libero perspiciatis hic.,Inactivo,Periodo 2002-2003
2397,e9602e5c59fe445989f3bff4701c8e73,Educación SocioEmocional,Vitae corporis delectus ipsa at iure officia.,Inactivo,Periodo 2007-2008
2398,b0a137d959d94d969e01607e84dc9cbd,Artes,Assumenda provident ipsam perspiciatis facere ipsum quam mollitia.,Inactivo,Periodo 2000-2001
2399,a93ecd221aab405face267a11468a6ed,Educación SocioEmocional,Neque consequatur iusto id.,Inactivo,Periodo 2007-2008
2400,5fc2a481548042869b4bf8813f038e68,Lenguaje y Comunicación,Ad tenetur culpa omnis enim modi doloremque.,Inactivo,Periodo 2006-2007
2401,7fe853c136094d7587e8f76860dc66a7,Pensamiento Matemáico,Itaque expedita libero vitae ab optio totam.,Inactivo,Periodo 2012-2013
2402,e996b945746b4978967d2e9c4782b613,Artes,Rem alias libero porro iusto.,Inactivo,Periodo 2014-2015
2403,284e32fc5b834eaf98d2d0e6c51c00e0,Educación SocioEmocional,Sapiente dolorem reprehenderit excepturi rerum ad minus.,Inactivo,Periodo 2004-2005
2404,8808531003de4bd48828d449d04260cd,Exploración y Comprensión del mundo natural y social,Nihil magni sunt nemo repudiandae.,Inactivo,Periodo 2004-2005
2405,8fa7ee53905a42ebafd7fab4340e4e17,Exploración y Comprensión del mundo natural y social,Officiis labore ut ipsum placeat.,Inactivo,Periodo 2005-2006
2406,8895f02817db4631b27686c9889139d4,Exploración y Comprensión del mundo natural y social,Temporibus architecto quas doloribus voluptas unde non exercitationem.,Inactivo,Periodo 2007-2008
2407,782c902c9af4487c8ee26808f5364998,Artes,Adipisci exercitationem neque dolorum expedita fuga reiciendis.,Inactivo,Periodo 2009-2010
2408,5d0827cac0e949c1a98c849c4bb4f2d0,Exploración y Comprensión del mundo natural y social,Corporis nemo ad asperiores nulla illum.,Inactivo,Periodo 2011-2012
2409,159cdd809a1b435abb073d2edd277c54,Artes,Odit accusamus labore reiciendis quia.,Inactivo,Periodo 2018-2019
2410,4f6a022dbc204b85acb65fb5b1f82e43,Educación SocioEmocional,Deleniti nam aliquid.,Inactivo,Periodo 2012-2013
2411,cd27260b955a4dc7b0562b6a339c347c,Lenguaje y Comunicación,Magni sunt occaecati vel dicta eius fuga.,Inactivo,Periodo 2016-2017
2412,2a2d1e80035d4ad7899ee73eb6ea2bec,Artes,Consequatur esse atque repudiandae numquam.,Inactivo,Periodo 2015-2026
2413,5706f094f1e947388493dc6c9d8f20ae,Artes,Blanditiis necessitatibus dolor culpa maxime.,Inactivo,Periodo 2008-2009
2414,be4f7e00decc42849ff6494acde17666,Educación SocioEmocional,Ipsum illo velit expedita.,Inactivo,Periodo 2005-2006
2415,aee91941ea4946cf8d72d99e16ca997f,Educación SocioEmocional,Eum in iure sunt nostrum est animi.,Inactivo,Periodo 2015-2026
2416,701b7a2e13884c7093fcaf94cb04ec05,Educación Fisica,Dicta asperiores asperiores quas eaque inventore.,Inactivo,Periodo 2004-2005
2417,31a05e53e4ea4b8384568b783929ed28,Educación SocioEmocional,Molestiae illo repellendus commodi sint earum.,Inactivo,Periodo 2001-2002
2418,a6314b7ed1e445d9a77fd76fae85566d,Artes,Laborum natus quas distinctio ducimus.,Inactivo,Periodo 2012-2013
2419,2764c9c8d4f1485b8a57b4d81d021cf1,Educación SocioEmocional,Commodi laborum soluta suscipit vel porro.,Inactivo,Periodo 2013-2014
2420,af7bed7bacef4550896a16bab3447df5,Educación SocioEmocional,Saepe sequi ex animi placeat ab excepturi.,Inactivo,Periodo 2001-2002
2421,495e5503dcf141eda0c43cba9e6e960c,Pensamiento Matemáico,Expedita dolor veritatis voluptatem quo.,Inactivo,Periodo 2010-2011
2422,22a3e636ee77434d802697b4be964fa0,Lenguaje y Comunicación,Dolorem corrupti beatae consequuntur deserunt sint.,Inactivo,Periodo 2011-2012
2423,09121d4c23124d05b5153ded0298f42e,Exploración y Comprensión del mundo natural y social,Exercitationem numquam assumenda facilis amet nesciunt explicabo.,Inactivo,Periodo 2004-2005
2424,9bc37b89e7a545798169963032c1bcff,Educación Fisica,Quae consequuntur dolores accusantium.,Inactivo,Periodo 2007-2008
2425,6a7df66c020d437e86d511e67e7f4ea2,Lenguaje y Comunicación,Ut ducimus nam autem unde harum repudiandae unde.,Inactivo,Periodo 2010-2011
2426,7f1833fc04d745028452c443157932ba,Lenguaje y Comunicación,Harum quis sapiente provident.,Inactivo,Periodo 2004-2005
2427,423e87927d98402084d5168412c72240,Artes,Fugit culpa est vel aliquid cupiditate iusto minima.,Inactivo,Periodo 2020-2021
2428,a0d7487b4ee04c22b968dda395afe6da,Exploración y Comprensión del mundo natural y social,Ratione culpa reiciendis quibusdam.,Inactivo,Periodo 2001-2002
2429,bbe6830363c6414a939cbb35cca3c60f,Artes,Quia harum non deserunt accusamus.,Inactivo,Periodo 2001-2002
2430,3f404d18f11c4cec9cf0077980b894aa,Artes,Corporis assumenda velit beatae ut.,Inactivo,Periodo 2004-2005
2431,0365ba1d3fc8470983df5a5c160ceebe,Artes,Vero fugit voluptate animi.,Inactivo,Periodo 2005-2006
2432,406d109c39a240d089a8df527744c20f,Artes,Mollitia at molestias nostrum dolore dolorum.,Inactivo,Periodo 2007-2008
2433,726f59bb595c4699af4a3905aaffb84c,Educación Fisica,Blanditiis facere fuga a doloremque beatae.,Inactivo,Periodo 2013-2014
2434,d89e7a2622f642d8b730897efcfb9e10,Pensamiento Matemáico,Amet sunt rerum.,Inactivo,Periodo 2004-2005
2435,055a30f3bd6c4aeb853efcb3d5bb4f24,Educación SocioEmocional,Tempora quisquam occaecati sed cumque.,Inactivo,Periodo 2013-2014
2436,72612a1a31cd4e61bb6aaefae9660a90,Educación Fisica,In explicabo expedita voluptas ab rem.,Inactivo,Periodo 2003-2004
2437,64b8cbf2747841e2ac540827c168e8f1,Educación Fisica,Suscipit voluptatibus at est vitae eligendi cupiditate.,Inactivo,Periodo 2015-2026
2438,bc9bf791b7aa45a5943f9265cd7e234c,Lenguaje y Comunicación,Tempore fuga vero.,Inactivo,Periodo 2000-2001
2439,a96a9aeb7ee44d2097ce696c76425862,Artes,Cumque cupiditate minus quis quam aperiam consectetur saepe.,Inactivo,Periodo 2007-2008
2440,3277beff7fa947b2a811bd8e6a386be3,Pensamiento Matemáico,Ad tenetur deleniti blanditiis.,Inactivo,Periodo 2002-2003
2441,cf31ffd25b0f4811b26235837605e324,Pensamiento Matemáico,Explicabo vero tenetur laboriosam non.,Inactivo,Periodo 2006-2007
2442,53d03aebc7504079a0be785b5b8f4a57,Educación Fisica,Iste dolore quaerat cumque perspiciatis fugiat mollitia.,Activo,Periodo 2022-2023
2443,65f0424468654c6091c28e04a21c2f1e,Lenguaje y Comunicación,Consequatur cum dignissimos dolores.,Inactivo,Periodo 2020-2021
2444,89c965c6fa544125b11e61b81bacde16,Educación Fisica,Harum laudantium officiis modi.,Inactivo,Periodo 2016-2017
2445,9da8211709d742e9aef9d622704b1c2d,Lenguaje y Comunicación,Enim cupiditate voluptate consequatur occaecati architecto assumenda iusto.,Inactivo,Periodo 2010-2011
2446,7c368caf017b4d50b858581b1f43543d,Lenguaje y Comunicación,Architecto asperiores veritatis recusandae porro ab alias non.,Inactivo,Periodo 2010-2011
2447,afa68f53a8614b469bf4467775bd4813,Lenguaje y Comunicación,Neque quo sit.,Activo,Periodo 2022-2023
2448,42c97b15f8b346e99b10bac8a89b8297,Lenguaje y Comunicación,Veniam similique quia aliquid.,Inactivo,Periodo 2015-2026
2449,5879363d4b5e408f9eb93a73f941d406,Pensamiento Matemáico,Occaecati asperiores provident fugiat consectetur distinctio.,Inactivo,Periodo 2009-2010
2450,c165058155c847ef9166c71856ba3149,Educación Fisica,Provident adipisci numquam vitae harum distinctio nisi.,Inactivo,Periodo 2015-2026
2451,0d02859a578742129b0e216dd2107a95,Educación SocioEmocional,Temporibus laboriosam vel accusantium.,Inactivo,Periodo 2019-2020
2452,a3551225d9aa4cb9808d45740be1b293,Pensamiento Matemáico,Eaque iste consequuntur quibusdam.,Inactivo,Periodo 2012-2013
2453,704db9a9850446e4ad7861e0267f3cdb,Educación Fisica,Impedit accusamus eius neque.,Activo,Periodo 2022-2023
2454,d0a066d8c5f34b7595d170ef8a071d06,Pensamiento Matemáico,Accusantium perferendis laboriosam delectus enim.,Inactivo,Periodo 2020-2021
2455,27ca1af6afa944e88abcb9754e5de1db,Exploración y Comprensión del mundo natural y social,Reprehenderit incidunt laudantium accusantium.,Inactivo,Periodo 2001-2002
2456,bb1f5f12d2af435890961783f7dde506,Educación Fisica,Repudiandae temporibus ducimus atque.,Inactivo,Periodo 2001-2002
2457,3b283525ee0d4971b6c6adba0e247e0f,Educación SocioEmocional,Mollitia illo sint veniam esse tempora reprehenderit.,Inactivo,Periodo 2009-2010
2458,8cd0e1d499984df9b5585e0d8b91640e,Lenguaje y Comunicación,Eius voluptas sequi hic.,Inactivo,Periodo 2016-2017
2459,73c6fb9913714d7d88ed98ebdf957302,Educación SocioEmocional,Animi amet possimus natus nobis cum.,Inactivo,Periodo 2017-2018
2460,afae0a8c8b374b93a1f2b6732eac1423,Educación Fisica,Deserunt in nulla.,Inactivo,Periodo 2010-2011
2461,e0278cfa592d4547ae75a5f8814f0207,Educación SocioEmocional,Nesciunt mollitia soluta itaque dolorem sed quisquam.,Inactivo,Periodo 2016-2017
2462,9f2719d86c0f49efb5c5e86ce085a406,Educación Fisica,Voluptatem veritatis iusto.,Inactivo,Periodo 2003-2004
2463,27cde67d35c3486994aacf4973b591df,Exploración y Comprensión del mundo natural y social,Explicabo velit numquam libero odio aliquid eligendi saepe.,Inactivo,Periodo 2010-2011
2464,3e62c952aba84601895f950ebc01ab2b,Pensamiento Matemáico,Eligendi quod animi minus ullam laudantium temporibus ducimus.,Inactivo,Periodo 2005-2006
2465,79bc32de15b24d788141fecdbd7d4da5,Pensamiento Matemáico,Eius rerum eaque blanditiis sequi error ratione.,Inactivo,Periodo 2020-2021
2466,445aeaf8477e4af9877f5dcc02d57be4,Artes,Veniam blanditiis officia ab quos.,Inactivo,Periodo 2000-2001
2467,60120a1e460c4f708b0905a35a4aa61d,Educación SocioEmocional,Ullam itaque soluta excepturi nesciunt suscipit.,Inactivo,Periodo 2011-2012
2468,80136f123d1e4e96bf06496119d5e529,Artes,Dolores omnis vero accusamus nesciunt error.,Inactivo,Periodo 2004-2005
2469,74f380d7856c423580ddc0dac6d33996,Educación SocioEmocional,Odit earum amet quos similique.,Inactivo,Periodo 2019-2020
2470,a0d8ced2f2bd432297fdbfacf1db157f,Pensamiento Matemáico,Ab distinctio quibusdam similique fugit quod quibusdam vitae.,Inactivo,Periodo 2020-2021
2471,a41016a846e04df98f254118f9b6fbe1,Educación SocioEmocional,Distinctio nihil tempora expedita officiis.,Inactivo,Periodo 2015-2026
2472,47d39a3c41e946408a748423bedf1f97,Educación SocioEmocional,Accusantium inventore odio non vero.,Inactivo,Periodo 2000-2001
2473,15a8b6eec9e74fb1aa37864c3924be3b,Lenguaje y Comunicación,Rerum sit temporibus sint delectus repellendus.,Inactivo,Periodo 2010-2011
2474,2bcb0ae966ce4fa69b5ba6555216bdbe,Educación Fisica,Repellat odio laborum ullam omnis repellendus maxime.,Inactivo,Periodo 2007-2008
2475,7c515b5e870844dd8357eeef3a4d603f,Exploración y Comprensión del mundo natural y social,Quas voluptatum cum culpa odio.,Inactivo,Periodo 2021-2022
2476,3c666144b2cf4516b77fb8f704f6d1d9,Lenguaje y Comunicación,Illo aperiam modi debitis nulla aspernatur.,Inactivo,Periodo 2005-2006
2477,fba526b41d8b46b6b46e052c720f1b81,Artes,Tempore odio accusamus nesciunt explicabo atque repellat.,Activo,Periodo 2022-2023
2478,cdafbccc2051459f8ce6f060ba01f6a2,Exploración y Comprensión del mundo natural y social,Quae consectetur qui.,Inactivo,Periodo 2021-2022
2479,6f34183f97cf46ac9daa0d6f2ee1269e,Lenguaje y Comunicación,Ab consectetur velit consequuntur voluptatum.,Inactivo,Periodo 2015-2026
2480,595a5c4b13a64717b3964bac0c2d9ace,Lenguaje y Comunicación,Similique quis odit molestias.,Inactivo,Periodo 2007-2008
2481,a3bfde4d846f46e2aa74497bc7e3fdd5,Artes,Explicabo molestias quae fugiat.,Inactivo,Periodo 2001-2002
2482,f487c3a3aaad4364851074af3ae26a26,Artes,Facilis animi dolores dolorem occaecati unde.,Inactivo,Periodo 2000-2001
2483,7ea737e73cb24beaa6e17e2ebea781d0,Pensamiento Matemáico,Eos error dolor officia.,Inactivo,Periodo 2006-2007
2484,c2407a006cec4ad69176dd389905999e,Lenguaje y Comunicación,Deleniti corrupti cumque officia reprehenderit numquam.,Activo,Periodo 2022-2023
2485,5680858f52764f309378505560e8f0d0,Educación Fisica,Iste accusantium quidem enim.,Inactivo,Periodo 2016-2017
2486,b989380652864df28a7c5301f2e62596,Pensamiento Matemáico,Error sint numquam ut.,Inactivo,Periodo 2021-2022
2487,7507acad245341858bb76dd71113d16e,Artes,Minus modi eaque.,Inactivo,Periodo 2020-2021
2488,142300a43c1c440aa814ab87e11be373,Pensamiento Matemáico,Fugit voluptates cumque consequuntur blanditiis.,Inactivo,Periodo 2013-2014
2489,c48f59070087415f908f341f4446b900,Educación Fisica,Fugiat harum magni officia.,Inactivo,Periodo 2008-2009
2490,1888b22e4e5b4d5e8ec3f1f8aee75d9d,Educación Fisica,Iusto enim rem doloribus laudantium quia sunt magni.,Inactivo,Periodo 2014-2015
2491,1c546bd677934c938090ef81b140acb2,Educación Fisica,Voluptates facere maiores rerum quisquam laudantium libero.,Inactivo,Periodo 2000-2001
2492,3ee98e74058e4c88a392c6ae14ecaecf,Lenguaje y Comunicación,Repudiandae ratione debitis repellendus necessitatibus iusto ipsam tempora.,Activo,Periodo 2022-2023
2493,11e3dd61efe14d80931f1a8f8519e48b,Educación SocioEmocional,Odio dignissimos odit aliquid unde quae libero.,Inactivo,Periodo 2007-2008
2494,1be05edb0e014e70a0c5011e7e61a305,Artes,Atque occaecati amet voluptatibus saepe nobis.,Inactivo,Periodo 2006-2007
2495,53d55592d6a84e1b9cdda4b31ed84069,Pensamiento Matemáico,Fugit suscipit natus corrupti.,Inactivo,Periodo 2000-2001
2496,26bcb5c52ef24793aad9133c5666bbe6,Educación SocioEmocional,Ea commodi officia cum optio voluptates.,Inactivo,Periodo 2020-2021
2497,57a9ffea7fea4a3f8df7baba22322e04,Educación SocioEmocional,Cumque tenetur delectus.,Inactivo,Periodo 2019-2020
2498,3c29e1d7e4ac4608ac402a33e2b03319,Educación SocioEmocional,Ea ad inventore culpa.,Inactivo,Periodo 2004-2005
2499,cab79f9f94a04515b1484f9d4be64ee1,Exploración y Comprensión del mundo natural y social,In dolore mollitia.,Inactivo,Periodo 2015-2026
2500,9a6df4b5100e4e3e983f838ed846dc4a,Artes,Doloribus officia commodi commodi.,Inactivo,Periodo 2008-2009
2501,6a679bb937ef4feca62140d158063a09,Lenguaje y Comunicación,Nihil asperiores magni vero.,Inactivo,Periodo 2015-2026
2502,565dc45e58b3409587d338022527b3eb,Educación Fisica,Perspiciatis nobis ducimus consequuntur corrupti asperiores pariatur.,Inactivo,Periodo 2002-2003
2503,f4818ad25f3446b1bf5edd943ee0c0ad,Educación Fisica,Quia debitis deleniti dolor doloremque cupiditate quos.,Inactivo,Periodo 2014-2015
2504,7bb7241bed68404ca81a4a8199b15fec,Artes,Similique nesciunt voluptates consequatur.,Inactivo,Periodo 2021-2022
2505,943d34affa12417d83e1b1398283510f,Exploración y Comprensión del mundo natural y social,Laborum maiores fugit quae voluptatem magnam.,Inactivo,Periodo 2012-2013
2506,883accaccd7b404cb02f572c7cc0a923,Exploración y Comprensión del mundo natural y social,Totam molestias cum sunt.,Inactivo,Periodo 2004-2005
2507,dd9a99917b37405b879cac50af271949,Lenguaje y Comunicación,Incidunt reprehenderit iure sint delectus aperiam quisquam cupiditate.,Inactivo,Periodo 2014-2015
2508,51a3a250c97849c48ef14cbda46197b0,Exploración y Comprensión del mundo natural y social,Quaerat nulla deleniti quod aliquid vitae.,Inactivo,Periodo 2018-2019
2509,2a57329ea0cc404b95da498167579cca,Educación SocioEmocional,Iure possimus vero provident minima neque.,Inactivo,Periodo 2014-2015
2510,b41f28b5b4c1494c84d0ebd86842e1a1,Educación Fisica,Eveniet nesciunt vel.,Inactivo,Periodo 2003-2004
2511,2cb058bbbcf641d8b099d09d509af6b2,Lenguaje y Comunicación,In sequi officiis odio ducimus molestiae.,Inactivo,Periodo 1999-2000
2512,f91d25f0af3445acb0da6569213f6a2b,Artes,Excepturi velit facere assumenda eum.,Inactivo,Periodo 2009-2010
2513,8d9141f9ed5048c1b8c555422fd80808,Educación Fisica,Similique esse quod exercitationem.,Inactivo,Periodo 2020-2021
2514,8dee1c995f834718a7ac321b398fdb66,Pensamiento Matemáico,Perspiciatis quis dolor doloribus mollitia amet.,Inactivo,Periodo 2000-2001
2515,233e01a84daf4c819c1eecbedb1f2b1b,Pensamiento Matemáico,Voluptatibus odit illum dolorem.,Inactivo,Periodo 2012-2013
2516,0fc7c40b554f4e3c85d6aad2bb329288,Exploración y Comprensión del mundo natural y social,Perferendis cupiditate ratione nobis incidunt.,Inactivo,Periodo 2006-2007
2517,5af4f3533a9147a6abe6148ddcec2122,Educación Fisica,Atque aperiam molestias provident reprehenderit deserunt porro.,Inactivo,Periodo 2012-2013
2518,ebdc9a806479430f9dab56805a6aaaf7,Pensamiento Matemáico,Illum ab perferendis laboriosam dolore.,Inactivo,Periodo 2015-2026
2519,e805a042f6fe4275b7f24ee46079c81f,Pensamiento Matemáico,Et aut pariatur fugit.,Inactivo,Periodo 2021-2022
2520,f461afbe360c40aa851b527614121802,Educación Fisica,Officia aperiam maxime natus maiores eius.,Inactivo,Periodo 2008-2009
2521,3ac8a200939c4d78b4ad7417ce1438b9,Lenguaje y Comunicación,Iste esse beatae eveniet explicabo eligendi.,Inactivo,Periodo 2000-2001
2522,a5b3b2d985a84d0498ebaca43db65e4d,Artes,Laborum nam odio quae consequuntur aspernatur mollitia.,Inactivo,Periodo 2004-2005
2523,eebc55504e8a46d7bc144f9787c3a29e,Lenguaje y Comunicación,Iure eligendi rem.,Inactivo,Periodo 2017-2018
2524,339e81394d4045c38e1a6fe8bf06d6bc,Educación SocioEmocional,Nulla modi expedita architecto officia.,Inactivo,Periodo 2019-2020
2525,e0da7b41f12f4790857ea62e0362e4c8,Educación SocioEmocional,Natus ipsum veritatis.,Inactivo,Periodo 2017-2018
2526,0ecfc39588fd4eeab77d2f2c8f123e07,Educación SocioEmocional,Inventore omnis incidunt facere.,Inactivo,Periodo 2010-2011
2527,51ece932c2fe4b8e9be9a084e66b80e1,Lenguaje y Comunicación,Enim a non labore aperiam.,Inactivo,Periodo 2000-2001
2528,accc61c4e4034de3a3d8bdedab0e751a,Educación SocioEmocional,Eos laborum quas dolores.,Inactivo,Periodo 2003-2004
2529,7b5de6e3794148a2b0623127fc638a8c,Exploración y Comprensión del mundo natural y social,Consequatur quo eligendi.,Inactivo,Periodo 2019-2020
2530,c6611d5aa18f4c9082b0592f3034a3c2,Educación Fisica,Quam eveniet non laudantium.,Inactivo,Periodo 2012-2013
2531,4af5eff904d94af6aa4675161cfdec8a,Educación SocioEmocional,Dicta dolor est provident odit quidem esse.,Activo,Periodo 2022-2023
